[
 {
  "id": 233403059,
  "url": "https://github.com/adrianharabula/condr/pull/179",
  "title": "added ajax call for votes and offers for products",
  "created_by": "elis47",
  "created_at": "6/4/2017",
  "body": "\n\n<!-- Reviewable:start -->\nThis change is [<img src=\"https://reviewable.io/review_button.svg\" height=\"34\" align=\"absmiddle\" alt=\"Reviewable\"/>](https://reviewable.io/reviews/adrianharabula/condr/179)\n<!-- Reviewable:end -->\n",
  "state": "closed",
  "comments": [
   {
    "url": "https://api.github.com/repos/adrianharabula/condr/issues/comments/306009628",
    "html_url": "https://github.com/adrianharabula/condr/pull/179#issuecomment-306009628",
    "issue_url": "https://api.github.com/repos/adrianharabula/condr/issues/179",
    "id": 306009628,
    "user": {
     "login": "adrianharabula",
     "id": 2271038,
     "avatar_url": "https://avatars0.githubusercontent.com/u/2271038?v=3",
     "gravatar_id": "",
     "url": "https://api.github.com/users/adrianharabula",
     "html_url": "https://github.com/adrianharabula",
     "followers_url": "https://api.github.com/users/adrianharabula/followers",
     "following_url": "https://api.github.com/users/adrianharabula/following{/other_user}",
     "gists_url": "https://api.github.com/users/adrianharabula/gists{/gist_id}",
     "starred_url": "https://api.github.com/users/adrianharabula/starred{/owner}{/repo}",
     "subscriptions_url": "https://api.github.com/users/adrianharabula/subscriptions",
     "organizations_url": "https://api.github.com/users/adrianharabula/orgs",
     "repos_url": "https://api.github.com/users/adrianharabula/repos",
     "events_url": "https://api.github.com/users/adrianharabula/events{/privacy}",
     "received_events_url": "https://api.github.com/users/adrianharabula/received_events",
     "type": "User",
     "site_admin": false
    },
    "created_at": "6/4/2017",
    "updated_at": "2017-06-04T00:27:09Z",
    "body": "\n\n\n\nReviewed 5 of 5 files at r1.\nReview status: all files reviewed at latest revision, all discussions resolved.\n\n---\n\n\n\n*Comments from [Reviewable](https://reviewable.io:443/reviews/adrianharabula/condr/179)*\n<!-- Sent from Reviewable.io -->\n"
   }
  ],
  "comments_url": "https://api.github.com/repos/adrianharabula/condr/issues/179/comments",
  "milestone": null,
  "quicklink": "adrianharabula/condr#179"
 },
 {
  "id": 230218785,
  "url": "https://github.com/adrianharabula/condr/issues/115",
  "title": "System notificări, de concretizat",
  "created_by": "adrianharabula",
  "created_at": "5/21/2017",
  "body": "Momentan nu avem un standard pentru notificări, dacă vrei să afişezi o eroare, nu ştii exact cum să faci.\r\n\r\nTrebuie făcut ceva simplu.\r\n\r\nGen, dacă ai o eroare, scrii asta şi va apărea asta aici.\r\n\r\nBările acelea colorate ar putea fi cu buton X în dreapta pentru a putea fi închise.",
  "state": "closed",
  "comments": [
   {
    "url": "https://api.github.com/repos/adrianharabula/condr/issues/comments/303892357",
    "html_url": "https://github.com/adrianharabula/condr/issues/115#issuecomment-303892357",
    "issue_url": "https://api.github.com/repos/adrianharabula/condr/issues/115",
    "id": 303892357,
    "user": {
     "login": "adrianharabula",
     "id": 2271038,
     "avatar_url": "https://avatars0.githubusercontent.com/u/2271038?v=3",
     "gravatar_id": "",
     "url": "https://api.github.com/users/adrianharabula",
     "html_url": "https://github.com/adrianharabula",
     "followers_url": "https://api.github.com/users/adrianharabula/followers",
     "following_url": "https://api.github.com/users/adrianharabula/following{/other_user}",
     "gists_url": "https://api.github.com/users/adrianharabula/gists{/gist_id}",
     "starred_url": "https://api.github.com/users/adrianharabula/starred{/owner}{/repo}",
     "subscriptions_url": "https://api.github.com/users/adrianharabula/subscriptions",
     "organizations_url": "https://api.github.com/users/adrianharabula/orgs",
     "repos_url": "https://api.github.com/users/adrianharabula/repos",
     "events_url": "https://api.github.com/users/adrianharabula/events{/privacy}",
     "received_events_url": "https://api.github.com/users/adrianharabula/received_events",
     "type": "User",
     "site_admin": false
    },
    "created_at": "5/25/2017",
    "updated_at": "2017-05-25T00:50:57Z",
    "body": "https://github.com/adrianharabula/condr/pull/135/commits/168b14ed1a11631e50058e0efed30b214e54e095"
   }
  ],
  "comments_url": "https://api.github.com/repos/adrianharabula/condr/issues/115/comments",
  "milestone": null,
  "quicklink": "adrianharabula/condr#115"
 },
 {
  "id": 233389520,
  "url": "https://github.com/adrianharabula/condr/issues/176",
  "title": "Groups Page doesn't work, GroupsController doesn't exist",
  "created_by": "Elena-Anghelina",
  "created_at": "6/3/2017",
  "body": "![gc](https://cloud.githubusercontent.com/assets/26334018/26756390/f4ccf860-48a9-11e7-9623-f260757c466c.PNG)\r\n",
  "state": "closed",
  "comments": [
   {
    "url": "https://api.github.com/repos/adrianharabula/condr/issues/comments/306032505",
    "html_url": "https://github.com/adrianharabula/condr/issues/176#issuecomment-306032505",
    "issue_url": "https://api.github.com/repos/adrianharabula/condr/issues/176",
    "id": 306032505,
    "user": {
     "login": "elis47",
     "id": 13468137,
     "avatar_url": "https://avatars2.githubusercontent.com/u/13468137?v=3",
     "gravatar_id": "",
     "url": "https://api.github.com/users/elis47",
     "html_url": "https://github.com/elis47",
     "followers_url": "https://api.github.com/users/elis47/followers",
     "following_url": "https://api.github.com/users/elis47/following{/other_user}",
     "gists_url": "https://api.github.com/users/elis47/gists{/gist_id}",
     "starred_url": "https://api.github.com/users/elis47/starred{/owner}{/repo}",
     "subscriptions_url": "https://api.github.com/users/elis47/subscriptions",
     "organizations_url": "https://api.github.com/users/elis47/orgs",
     "repos_url": "https://api.github.com/users/elis47/repos",
     "events_url": "https://api.github.com/users/elis47/events{/privacy}",
     "received_events_url": "https://api.github.com/users/elis47/received_events",
     "type": "User",
     "site_admin": false
    },
    "created_at": "6/4/2017",
    "updated_at": "2017-06-04T10:46:19Z",
    "body": "fixed !"
   }
  ],
  "comments_url": "https://api.github.com/repos/adrianharabula/condr/issues/176/comments",
  "milestone": null,
  "quicklink": "adrianharabula/condr#176"
 },
 {
  "id": 232948121,
  "url": "https://github.com/adrianharabula/condr/pull/164",
  "title": "added pagination, changes at groups page (now, works the buttons for delete a group and appear all error messages for join and delete )",
  "created_by": "Madalina-Buza",
  "created_at": "6/1/2017",
  "body": "\n\n<!-- Reviewable:start -->\nThis change is [<img src=\"https://reviewable.io/review_button.svg\" height=\"34\" align=\"absmiddle\" alt=\"Reviewable\"/>](https://reviewable.io/reviews/adrianharabula/condr/164)\n<!-- Reviewable:end -->\n",
  "state": "closed",
  "comments": [
   {
    "url": "https://api.github.com/repos/adrianharabula/condr/issues/comments/305563742",
    "html_url": "https://github.com/adrianharabula/condr/pull/164#issuecomment-305563742",
    "issue_url": "https://api.github.com/repos/adrianharabula/condr/issues/164",
    "id": 305563742,
    "user": {
     "login": "adrianharabula",
     "id": 2271038,
     "avatar_url": "https://avatars0.githubusercontent.com/u/2271038?v=3",
     "gravatar_id": "",
     "url": "https://api.github.com/users/adrianharabula",
     "html_url": "https://github.com/adrianharabula",
     "followers_url": "https://api.github.com/users/adrianharabula/followers",
     "following_url": "https://api.github.com/users/adrianharabula/following{/other_user}",
     "gists_url": "https://api.github.com/users/adrianharabula/gists{/gist_id}",
     "starred_url": "https://api.github.com/users/adrianharabula/starred{/owner}{/repo}",
     "subscriptions_url": "https://api.github.com/users/adrianharabula/subscriptions",
     "organizations_url": "https://api.github.com/users/adrianharabula/orgs",
     "repos_url": "https://api.github.com/users/adrianharabula/repos",
     "events_url": "https://api.github.com/users/adrianharabula/events{/privacy}",
     "received_events_url": "https://api.github.com/users/adrianharabula/received_events",
     "type": "User",
     "site_admin": false
    },
    "created_at": "6/1/2017",
    "updated_at": "2017-06-01T17:29:20Z",
    "body": "\n\n\n\nReviewed 8 of 8 files at r1.\nReview status: all files reviewed at latest revision, 1 unresolved discussion.\n\n---\n\n*[app/resources/views/user/favorited-groups.blade.php, line 37 at r1](https://reviewable.io:443/reviews/adrianharabula/condr/164#-KlZgqld05NebPoQtLRF:-KlZgqlem3pdFbgs6DnD:beopjgg) ([raw file](https://github.com/adrianharabula/condr/blob/48c8d46c8be1a9cb82b03c498686a4a6f476afc8/app/resources/views/user/favorited-groups.blade.php#L37)):*\n> ```PHP\n>                </div>\n>                <div class=\"col-md-2\">\n>                   {!! Form::open(['method' => 'DELETE', 'url'=> route('my.group.delete', $group->id)]) !!}\n> ```\n\nde ce aici nu merge deschis formularul cu {{ simplu?\n\n---\n\n\n*Comments from [Reviewable](https://reviewable.io:443/reviews/adrianharabula/condr/164)*\n<!-- Sent from Reviewable.io -->\n"
   }
  ],
  "comments_url": "https://api.github.com/repos/adrianharabula/condr/issues/164/comments",
  "milestone": null,
  "quicklink": "adrianharabula/condr#164"
 },
 {
  "id": 233417778,
  "url": "https://github.com/adrianharabula/condr/issues/180",
  "title": "Last weekend sprint",
  "created_by": "adrianharabula",
  "created_at": "6/4/2017",
  "body": "Încă un weekend rămas... tura aceastea chiar e ultimul :)) Mai avem asa:\r\n\r\n- [ ] duminica\r\n- [ ] luni\r\n- [ ] marti\r\n\r\nDe facut ar mai fi:\r\n\r\n- [ ] formularul de contact de făcut (să trimită mailuri la submit)\r\n- [ ] pagina groups de făcut să arate frumos\r\n- [ ] pagina add preferences (de ce facem asta?)\r\n- [ ] paginare de făcut pentru produse\r\n- [ ] pentru un produs anume de arătat sugestii de cumpărare\r\n- [ ] stylizare mygroups\r\n- [ ] stilizare site in general\r\n- alte chestii, to be updated",
  "state": "open",
  "comments": [],
  "comments_url": "https://api.github.com/repos/adrianharabula/condr/issues/180/comments",
  "milestone": null,
  "quicklink": "adrianharabula/condr#180"
 },
 {
  "id": 231261298,
  "url": "https://github.com/adrianharabula/condr/issues/136",
  "title": "get values and votes for a specific characteristic related to a product",
  "created_by": "adrianharabula",
  "created_at": "5/25/2017",
  "body": "Probably there will be a special function in model.",
  "state": "closed",
  "comments": [
   {
    "url": "https://api.github.com/repos/adrianharabula/condr/issues/comments/304476070",
    "html_url": "https://github.com/adrianharabula/condr/issues/136#issuecomment-304476070",
    "issue_url": "https://api.github.com/repos/adrianharabula/condr/issues/136",
    "id": 304476070,
    "user": {
     "login": "adrianharabula",
     "id": 2271038,
     "avatar_url": "https://avatars0.githubusercontent.com/u/2271038?v=3",
     "gravatar_id": "",
     "url": "https://api.github.com/users/adrianharabula",
     "html_url": "https://github.com/adrianharabula",
     "followers_url": "https://api.github.com/users/adrianharabula/followers",
     "following_url": "https://api.github.com/users/adrianharabula/following{/other_user}",
     "gists_url": "https://api.github.com/users/adrianharabula/gists{/gist_id}",
     "starred_url": "https://api.github.com/users/adrianharabula/starred{/owner}{/repo}",
     "subscriptions_url": "https://api.github.com/users/adrianharabula/subscriptions",
     "organizations_url": "https://api.github.com/users/adrianharabula/orgs",
     "repos_url": "https://api.github.com/users/adrianharabula/repos",
     "events_url": "https://api.github.com/users/adrianharabula/events{/privacy}",
     "received_events_url": "https://api.github.com/users/adrianharabula/received_events",
     "type": "User",
     "site_admin": false
    },
    "created_at": "5/27/2017",
    "updated_at": "2017-05-27T20:54:46Z",
    "body": "not relevant anymore"
   }
  ],
  "comments_url": "https://api.github.com/repos/adrianharabula/condr/issues/136/comments",
  "milestone": null,
  "quicklink": "adrianharabula/condr#136"
 },
 {
  "id": 233427476,
  "url": "https://github.com/adrianharabula/condr/pull/183",
  "title": "Elisa work",
  "created_by": "adrianharabula",
  "created_at": "6/4/2017",
  "body": "\n\n<!-- Reviewable:start -->\nThis change is [<img src=\"https://reviewable.io/review_button.svg\" height=\"34\" align=\"absmiddle\" alt=\"Reviewable\"/>](https://reviewable.io/reviews/adrianharabula/condr/183)\n<!-- Reviewable:end -->\n",
  "state": "closed",
  "comments": [
   {
    "url": "https://api.github.com/repos/adrianharabula/condr/issues/comments/306041122",
    "html_url": "https://github.com/adrianharabula/condr/pull/183#issuecomment-306041122",
    "issue_url": "https://api.github.com/repos/adrianharabula/condr/issues/183",
    "id": 306041122,
    "user": {
     "login": "adrianharabula",
     "id": 2271038,
     "avatar_url": "https://avatars0.githubusercontent.com/u/2271038?v=3",
     "gravatar_id": "",
     "url": "https://api.github.com/users/adrianharabula",
     "html_url": "https://github.com/adrianharabula",
     "followers_url": "https://api.github.com/users/adrianharabula/followers",
     "following_url": "https://api.github.com/users/adrianharabula/following{/other_user}",
     "gists_url": "https://api.github.com/users/adrianharabula/gists{/gist_id}",
     "starred_url": "https://api.github.com/users/adrianharabula/starred{/owner}{/repo}",
     "subscriptions_url": "https://api.github.com/users/adrianharabula/subscriptions",
     "organizations_url": "https://api.github.com/users/adrianharabula/orgs",
     "repos_url": "https://api.github.com/users/adrianharabula/repos",
     "events_url": "https://api.github.com/users/adrianharabula/events{/privacy}",
     "received_events_url": "https://api.github.com/users/adrianharabula/received_events",
     "type": "User",
     "site_admin": false
    },
    "created_at": "6/4/2017",
    "updated_at": "2017-06-04T13:49:23Z",
    "body": "\n\n\n\nReviewed 8 of 9 files at r1.\nReview status: 6 of 7 files reviewed at latest revision, all discussions resolved.\n\n---\n\n\n\n*Comments from [Reviewable](https://reviewable.io:443/reviews/adrianharabula/condr/183)*\n<!-- Sent from Reviewable.io -->\n"
   },
   {
    "url": "https://api.github.com/repos/adrianharabula/condr/issues/comments/306045258",
    "html_url": "https://github.com/adrianharabula/condr/pull/183#issuecomment-306045258",
    "issue_url": "https://api.github.com/repos/adrianharabula/condr/issues/183",
    "id": 306045258,
    "user": {
     "login": "adrianharabula",
     "id": 2271038,
     "avatar_url": "https://avatars0.githubusercontent.com/u/2271038?v=3",
     "gravatar_id": "",
     "url": "https://api.github.com/users/adrianharabula",
     "html_url": "https://github.com/adrianharabula",
     "followers_url": "https://api.github.com/users/adrianharabula/followers",
     "following_url": "https://api.github.com/users/adrianharabula/following{/other_user}",
     "gists_url": "https://api.github.com/users/adrianharabula/gists{/gist_id}",
     "starred_url": "https://api.github.com/users/adrianharabula/starred{/owner}{/repo}",
     "subscriptions_url": "https://api.github.com/users/adrianharabula/subscriptions",
     "organizations_url": "https://api.github.com/users/adrianharabula/orgs",
     "repos_url": "https://api.github.com/users/adrianharabula/repos",
     "events_url": "https://api.github.com/users/adrianharabula/events{/privacy}",
     "received_events_url": "https://api.github.com/users/adrianharabula/received_events",
     "type": "User",
     "site_admin": false
    },
    "created_at": "6/4/2017",
    "updated_at": "2017-06-04T15:01:33Z",
    "body": "De ce e re-adăugat fişierul [app/resources/views/user/favorited-products.blade.php](https://reviewable.io/reviews/adrianharabula/condr/183/app/resources/views/user/favorited-products.blade.php)?"
   },
   {
    "url": "https://api.github.com/repos/adrianharabula/condr/issues/comments/306050886",
    "html_url": "https://github.com/adrianharabula/condr/pull/183#issuecomment-306050886",
    "issue_url": "https://api.github.com/repos/adrianharabula/condr/issues/183",
    "id": 306050886,
    "user": {
     "login": "elis47",
     "id": 13468137,
     "avatar_url": "https://avatars2.githubusercontent.com/u/13468137?v=3",
     "gravatar_id": "",
     "url": "https://api.github.com/users/elis47",
     "html_url": "https://github.com/elis47",
     "followers_url": "https://api.github.com/users/elis47/followers",
     "following_url": "https://api.github.com/users/elis47/following{/other_user}",
     "gists_url": "https://api.github.com/users/elis47/gists{/gist_id}",
     "starred_url": "https://api.github.com/users/elis47/starred{/owner}{/repo}",
     "subscriptions_url": "https://api.github.com/users/elis47/subscriptions",
     "organizations_url": "https://api.github.com/users/elis47/orgs",
     "repos_url": "https://api.github.com/users/elis47/repos",
     "events_url": "https://api.github.com/users/elis47/events{/privacy}",
     "received_events_url": "https://api.github.com/users/elis47/received_events",
     "type": "User",
     "site_admin": false
    },
    "created_at": "6/4/2017",
    "updated_at": "2017-06-04T16:32:35Z",
    "body": "a fost un merge aiurea cred :))"
   }
  ],
  "comments_url": "https://api.github.com/repos/adrianharabula/condr/issues/183/comments",
  "milestone": null,
  "quicklink": "adrianharabula/condr#183"
 },
 {
  "id": 232808188,
  "url": "https://github.com/adrianharabula/condr/pull/162",
  "title": "add document user",
  "created_by": "adrianharabula",
  "created_at": "6/1/2017",
  "body": "\n\n<!-- Reviewable:start -->\nThis change is [<img src=\"https://reviewable.io/review_button.svg\" height=\"34\" align=\"absmiddle\" alt=\"Reviewable\"/>](https://reviewable.io/reviews/adrianharabula/condr/162)\n<!-- Reviewable:end -->\n",
  "state": "closed",
  "comments": [],
  "comments_url": "https://api.github.com/repos/adrianharabula/condr/issues/162/comments",
  "milestone": null,
  "quicklink": "adrianharabula/condr#162"
 },
 {
  "id": 226835715,
  "url": "https://github.com/adrianharabula/condr/issues/59",
  "title": "[Duplicate #63] Regenerează Desen baza de date",
  "created_by": "adrianharabula",
  "created_at": "5/7/2017",
  "body": "",
  "state": "closed",
  "comments": [],
  "comments_url": "https://api.github.com/repos/adrianharabula/condr/issues/59/comments",
  "milestone": null,
  "quicklink": "adrianharabula/condr#59"
 },
 {
  "id": 233436776,
  "url": "https://github.com/adrianharabula/condr/pull/187",
  "title": "fix upc array error",
  "created_by": "adrianharabula",
  "created_at": "6/4/2017",
  "body": "\n\n<!-- Reviewable:start -->\nThis change is [<img src=\"https://reviewable.io/review_button.svg\" height=\"34\" align=\"absmiddle\" alt=\"Reviewable\"/>](https://reviewable.io/reviews/adrianharabula/condr/187)\n<!-- Reviewable:end -->\n",
  "state": "closed",
  "comments": [],
  "comments_url": "https://api.github.com/repos/adrianharabula/condr/issues/187/comments",
  "milestone": null,
  "quicklink": "adrianharabula/condr#187"
 },
 {
  "id": 226861625,
  "url": "https://github.com/adrianharabula/condr/issues/62",
  "title": "Make procedure in SQL to remove all existing tables&sequences; for easier database reinitialization",
  "created_by": "adrianharabula",
  "created_at": "5/7/2017",
  "body": "```\r\nBEGIN\r\n\r\n  --Bye Sequences!\r\n  FOR i IN (SELECT us.sequence_name\r\n              FROM USER_SEQUENCES us) LOOP\r\n    EXECUTE IMMEDIATE 'drop sequence '|| i.sequence_name ||'';\r\n  END LOOP;\r\n\r\n  --Bye Tables!\r\n  FOR i IN (SELECT ut.table_name\r\n              FROM USER_TABLES ut) LOOP\r\n    EXECUTE IMMEDIATE 'drop table '|| i.table_name ||' CASCADE CONSTRAINTS ';\r\n  END LOOP;\r\n\r\nEND;\r\n```",
  "state": "closed",
  "comments": [
   {
    "url": "https://api.github.com/repos/adrianharabula/condr/issues/comments/300081685",
    "html_url": "https://github.com/adrianharabula/condr/issues/62#issuecomment-300081685",
    "issue_url": "https://api.github.com/repos/adrianharabula/condr/issues/62",
    "id": 300081685,
    "user": {
     "login": "adrianharabula",
     "id": 2271038,
     "avatar_url": "https://avatars0.githubusercontent.com/u/2271038?v=3",
     "gravatar_id": "",
     "url": "https://api.github.com/users/adrianharabula",
     "html_url": "https://github.com/adrianharabula",
     "followers_url": "https://api.github.com/users/adrianharabula/followers",
     "following_url": "https://api.github.com/users/adrianharabula/following{/other_user}",
     "gists_url": "https://api.github.com/users/adrianharabula/gists{/gist_id}",
     "starred_url": "https://api.github.com/users/adrianharabula/starred{/owner}{/repo}",
     "subscriptions_url": "https://api.github.com/users/adrianharabula/subscriptions",
     "organizations_url": "https://api.github.com/users/adrianharabula/orgs",
     "repos_url": "https://api.github.com/users/adrianharabula/repos",
     "events_url": "https://api.github.com/users/adrianharabula/events{/privacy}",
     "received_events_url": "https://api.github.com/users/adrianharabula/received_events",
     "type": "User",
     "site_admin": false
    },
    "created_at": "5/9/2017",
    "updated_at": "2017-05-09T08:02:32Z",
    "body": "Procedura arata așa:\r\n```sql\r\ncreate or replace PROCEDURE purgedatabase AS\r\nbegin\r\n\r\n  --Bye Sequences!\r\n  FOR i IN (SELECT us.sequence_name\r\n              FROM USER_SEQUENCES us) LOOP\r\n    EXECUTE IMMEDIATE 'drop sequence '|| i.sequence_name ||'';\r\n  END LOOP;\r\n\r\n  --Bye Tables!\r\n  FOR i IN (SELECT ut.table_name\r\n              FROM USER_TABLES ut) LOOP\r\n    EXECUTE IMMEDIATE 'drop table '|| i.table_name ||' CASCADE CONSTRAINTS ';\r\n  END LOOP;\r\n\r\nEND;\r\n```\r\n\r\nSe apealează așa:\r\n```sql\r\ncall purgedatabase()\r\n```\r\nsau din bloc anonim\r\n```sql\r\nbegin\r\n  purgedatabase;\r\nend;\r\n```\r\n\r\nSe folosește când vrem să curățăm baza de date, să o creem din nou. Șterge toate tabelele, toate triggerele și toate secvențele."
   }
  ],
  "comments_url": "https://api.github.com/repos/adrianharabula/condr/issues/62/comments",
  "milestone": null,
  "quicklink": "adrianharabula/condr#62"
 },
 {
  "id": 229003750,
  "url": "https://github.com/adrianharabula/condr/issues/89",
  "title": "Fix duplicated relationship generated in CondrgroupUserTableSeeder",
  "created_by": "elis47",
  "created_at": "5/16/2017",
  "body": "",
  "state": "open",
  "comments": [],
  "comments_url": "https://api.github.com/repos/adrianharabula/condr/issues/89/comments",
  "milestone": null,
  "quicklink": "adrianharabula/condr#89"
 },
 {
  "id": 233375511,
  "url": "https://github.com/adrianharabula/condr/pull/171",
  "title": "Fixed duplicated entries for offers and characterizables",
  "created_by": "adrianharabula",
  "created_at": "6/3/2017",
  "body": "\n\n<!-- Reviewable:start -->\nThis change is [<img src=\"https://reviewable.io/review_button.svg\" height=\"34\" align=\"absmiddle\" alt=\"Reviewable\"/>](https://reviewable.io/reviews/adrianharabula/condr/171)\n<!-- Reviewable:end -->\n",
  "state": "closed",
  "comments": [
   {
    "url": "https://api.github.com/repos/adrianharabula/condr/issues/comments/306000005",
    "html_url": "https://github.com/adrianharabula/condr/pull/171#issuecomment-306000005",
    "issue_url": "https://api.github.com/repos/adrianharabula/condr/issues/171",
    "id": 306000005,
    "user": {
     "login": "elis47",
     "id": 13468137,
     "avatar_url": "https://avatars2.githubusercontent.com/u/13468137?v=3",
     "gravatar_id": "",
     "url": "https://api.github.com/users/elis47",
     "html_url": "https://github.com/elis47",
     "followers_url": "https://api.github.com/users/elis47/followers",
     "following_url": "https://api.github.com/users/elis47/following{/other_user}",
     "gists_url": "https://api.github.com/users/elis47/gists{/gist_id}",
     "starred_url": "https://api.github.com/users/elis47/starred{/owner}{/repo}",
     "subscriptions_url": "https://api.github.com/users/elis47/subscriptions",
     "organizations_url": "https://api.github.com/users/elis47/orgs",
     "repos_url": "https://api.github.com/users/elis47/repos",
     "events_url": "https://api.github.com/users/elis47/events{/privacy}",
     "received_events_url": "https://api.github.com/users/elis47/received_events",
     "type": "User",
     "site_admin": false
    },
    "created_at": "6/3/2017",
    "updated_at": "2017-06-03T20:37:25Z",
    "body": "\n\n\n\nReviewed 5 of 6 files at r1, 1 of 1 files at r2.\nReview status: all files reviewed at latest revision, all discussions resolved.\n\n---\n\n\n\n*Comments from [Reviewable](https://reviewable.io:443/reviews/adrianharabula/condr/171)*\n<!-- Sent from Reviewable.io -->\n"
   }
  ],
  "comments_url": "https://api.github.com/repos/adrianharabula/condr/issues/171/comments",
  "milestone": null,
  "quicklink": "adrianharabula/condr#171"
 },
 {
  "id": 228111234,
  "url": "https://github.com/adrianharabula/condr/issues/76",
  "title": "Add ProductsTableSeeder",
  "created_by": "adrianharabula",
  "created_at": "5/11/2017",
  "body": "Generate random products using\r\nrandom image generator here https://github.com/fzaninotto/Faker#fakerproviderimage\r\nand\r\nrandom barcode generator here https://github.com/fzaninotto/Faker#fakerproviderbarcode (folosim ean13)",
  "state": "open",
  "comments": [
   {
    "url": "https://api.github.com/repos/adrianharabula/condr/issues/comments/300907973",
    "html_url": "https://github.com/adrianharabula/condr/issues/76#issuecomment-300907973",
    "issue_url": "https://api.github.com/repos/adrianharabula/condr/issues/76",
    "id": 300907973,
    "user": {
     "login": "adrianharabula",
     "id": 2271038,
     "avatar_url": "https://avatars0.githubusercontent.com/u/2271038?v=3",
     "gravatar_id": "",
     "url": "https://api.github.com/users/adrianharabula",
     "html_url": "https://github.com/adrianharabula",
     "followers_url": "https://api.github.com/users/adrianharabula/followers",
     "following_url": "https://api.github.com/users/adrianharabula/following{/other_user}",
     "gists_url": "https://api.github.com/users/adrianharabula/gists{/gist_id}",
     "starred_url": "https://api.github.com/users/adrianharabula/starred{/owner}{/repo}",
     "subscriptions_url": "https://api.github.com/users/adrianharabula/subscriptions",
     "organizations_url": "https://api.github.com/users/adrianharabula/orgs",
     "repos_url": "https://api.github.com/users/adrianharabula/repos",
     "events_url": "https://api.github.com/users/adrianharabula/events{/privacy}",
     "received_events_url": "https://api.github.com/users/adrianharabula/received_events",
     "type": "User",
     "site_admin": false
    },
    "created_at": "5/11/2017",
    "updated_at": "2017-05-11T20:29:08Z",
    "body": "A se vedea și #64 pentru logica cum stocăm imaginile, atât în baza de date, cât și pe hdd."
   }
  ],
  "comments_url": "https://api.github.com/repos/adrianharabula/condr/issues/76/comments",
  "milestone": null,
  "quicklink": "adrianharabula/condr#76"
 },
 {
  "id": 233363385,
  "url": "https://github.com/adrianharabula/condr/pull/168",
  "title": "added ajax call",
  "created_by": "elis47",
  "created_at": "6/3/2017",
  "body": "\n\n<!-- Reviewable:start -->\nThis change is [<img src=\"https://reviewable.io/review_button.svg\" height=\"34\" align=\"absmiddle\" alt=\"Reviewable\"/>](https://reviewable.io/reviews/adrianharabula/condr/168)\n<!-- Reviewable:end -->\n",
  "state": "closed",
  "comments": [
   {
    "url": "https://api.github.com/repos/adrianharabula/condr/issues/comments/305968779",
    "html_url": "https://github.com/adrianharabula/condr/pull/168#issuecomment-305968779",
    "issue_url": "https://api.github.com/repos/adrianharabula/condr/issues/168",
    "id": 305968779,
    "user": {
     "login": "adrianharabula",
     "id": 2271038,
     "avatar_url": "https://avatars0.githubusercontent.com/u/2271038?v=3",
     "gravatar_id": "",
     "url": "https://api.github.com/users/adrianharabula",
     "html_url": "https://github.com/adrianharabula",
     "followers_url": "https://api.github.com/users/adrianharabula/followers",
     "following_url": "https://api.github.com/users/adrianharabula/following{/other_user}",
     "gists_url": "https://api.github.com/users/adrianharabula/gists{/gist_id}",
     "starred_url": "https://api.github.com/users/adrianharabula/starred{/owner}{/repo}",
     "subscriptions_url": "https://api.github.com/users/adrianharabula/subscriptions",
     "organizations_url": "https://api.github.com/users/adrianharabula/orgs",
     "repos_url": "https://api.github.com/users/adrianharabula/repos",
     "events_url": "https://api.github.com/users/adrianharabula/events{/privacy}",
     "received_events_url": "https://api.github.com/users/adrianharabula/received_events",
     "type": "User",
     "site_admin": false
    },
    "created_at": "6/3/2017",
    "updated_at": "2017-06-03T11:20:50Z",
    "body": "\n\n\n\nReviewed 2 of 2 files at r1.\nReview status: all files reviewed at latest revision, 1 unresolved discussion.\n\n---\n\n*[app/resources/views/layouts/app.blade.php, line 36 at r1](https://reviewable.io:443/reviews/adrianharabula/condr/168#-Klhfl25rGbBTvx_FU9F:-Klhfl25rGbBTvx_FU9G:b-crr5kk) ([raw file](https://github.com/adrianharabula/condr/blob/15e17050a7d835a0a571ba6276b22e04b78f8ba4/app/resources/views/layouts/app.blade.php#L36)):*\n> ```PHP\n>     </script>\n> \n>     <script src=\"//ajax.googleapis.com/ajax/libs/jquery/3.2.1/jquery.min.js\"></script>\n> ```\n\no sa vedem cum facem cu jquery, tre pusa versiune compatibila cu bootstrap.\n\n---\n\n\n*Comments from [Reviewable](https://reviewable.io:443/reviews/adrianharabula/condr/168)*\n<!-- Sent from Reviewable.io -->\n"
   },
   {
    "url": "https://api.github.com/repos/adrianharabula/condr/issues/comments/305968804",
    "html_url": "https://github.com/adrianharabula/condr/pull/168#issuecomment-305968804",
    "issue_url": "https://api.github.com/repos/adrianharabula/condr/issues/168",
    "id": 305968804,
    "user": {
     "login": "adrianharabula",
     "id": 2271038,
     "avatar_url": "https://avatars0.githubusercontent.com/u/2271038?v=3",
     "gravatar_id": "",
     "url": "https://api.github.com/users/adrianharabula",
     "html_url": "https://github.com/adrianharabula",
     "followers_url": "https://api.github.com/users/adrianharabula/followers",
     "following_url": "https://api.github.com/users/adrianharabula/following{/other_user}",
     "gists_url": "https://api.github.com/users/adrianharabula/gists{/gist_id}",
     "starred_url": "https://api.github.com/users/adrianharabula/starred{/owner}{/repo}",
     "subscriptions_url": "https://api.github.com/users/adrianharabula/subscriptions",
     "organizations_url": "https://api.github.com/users/adrianharabula/orgs",
     "repos_url": "https://api.github.com/users/adrianharabula/repos",
     "events_url": "https://api.github.com/users/adrianharabula/events{/privacy}",
     "received_events_url": "https://api.github.com/users/adrianharabula/received_events",
     "type": "User",
     "site_admin": false
    },
    "created_at": "6/3/2017",
    "updated_at": "2017-06-03T11:21:32Z",
    "body": "\n\n\n\nReview status: all files reviewed at latest revision, 1 unresolved discussion.\n\n---\n\n*[app/resources/views/layouts/app.blade.php, line 36 at r1](https://reviewable.io:443/reviews/adrianharabula/condr/168#-Klhfl25rGbBTvx_FU9F:-Klhg0RRjMyTk4AhYnfL:b-rquaz7) ([raw file](https://github.com/adrianharabula/condr/blob/15e17050a7d835a0a571ba6276b22e04b78f8ba4/app/resources/views/layouts/app.blade.php#L36)):*\n> …app/resources/views/products/listproducts.blade.phpapp/resources/views/\n3.2.1 e prea mare, cred cĂ maxim suportat e 3.0.0\n\n---\n\n\n*Comments from [Reviewable](https://reviewable.io:443/reviews/adrianharabula/condr/168)*\n<!-- Sent from Reviewable.io -->\n"
   },
   {
    "url": "https://api.github.com/repos/adrianharabula/condr/issues/comments/305971570",
    "html_url": "https://github.com/adrianharabula/condr/pull/168#issuecomment-305971570",
    "issue_url": "https://api.github.com/repos/adrianharabula/condr/issues/168",
    "id": 305971570,
    "user": {
     "login": "elis47",
     "id": 13468137,
     "avatar_url": "https://avatars2.githubusercontent.com/u/13468137?v=3",
     "gravatar_id": "",
     "url": "https://api.github.com/users/elis47",
     "html_url": "https://github.com/elis47",
     "followers_url": "https://api.github.com/users/elis47/followers",
     "following_url": "https://api.github.com/users/elis47/following{/other_user}",
     "gists_url": "https://api.github.com/users/elis47/gists{/gist_id}",
     "starred_url": "https://api.github.com/users/elis47/starred{/owner}{/repo}",
     "subscriptions_url": "https://api.github.com/users/elis47/subscriptions",
     "organizations_url": "https://api.github.com/users/elis47/orgs",
     "repos_url": "https://api.github.com/users/elis47/repos",
     "events_url": "https://api.github.com/users/elis47/events{/privacy}",
     "received_events_url": "https://api.github.com/users/elis47/received_events",
     "type": "User",
     "site_admin": false
    },
    "created_at": "6/3/2017",
    "updated_at": "2017-06-03T12:18:37Z",
    "body": "\n\n\n\nReviewed 1 of 3 files at r2.\nReview status: 1 of 3 files reviewed at latest revision, 1 unresolved discussion.\n\n---\n\n\n\n*Comments from [Reviewable](https://reviewable.io:443/reviews/adrianharabula/condr/168)*\n<!-- Sent from Reviewable.io -->\n"
   },
   {
    "url": "https://api.github.com/repos/adrianharabula/condr/issues/comments/305976434",
    "html_url": "https://github.com/adrianharabula/condr/pull/168#issuecomment-305976434",
    "issue_url": "https://api.github.com/repos/adrianharabula/condr/issues/168",
    "id": 305976434,
    "user": {
     "login": "elis47",
     "id": 13468137,
     "avatar_url": "https://avatars2.githubusercontent.com/u/13468137?v=3",
     "gravatar_id": "",
     "url": "https://api.github.com/users/elis47",
     "html_url": "https://github.com/elis47",
     "followers_url": "https://api.github.com/users/elis47/followers",
     "following_url": "https://api.github.com/users/elis47/following{/other_user}",
     "gists_url": "https://api.github.com/users/elis47/gists{/gist_id}",
     "starred_url": "https://api.github.com/users/elis47/starred{/owner}{/repo}",
     "subscriptions_url": "https://api.github.com/users/elis47/subscriptions",
     "organizations_url": "https://api.github.com/users/elis47/orgs",
     "repos_url": "https://api.github.com/users/elis47/repos",
     "events_url": "https://api.github.com/users/elis47/events{/privacy}",
     "received_events_url": "https://api.github.com/users/elis47/received_events",
     "type": "User",
     "site_admin": false
    },
    "created_at": "6/3/2017",
    "updated_at": "2017-06-03T13:52:24Z",
    "body": "\n\n\n\nReviewed 2 of 3 files at r2.\nReview status: all files reviewed at latest revision, 1 unresolved discussion.\n\n---\n\n\n\n*Comments from [Reviewable](https://reviewable.io:443/reviews/adrianharabula/condr/168)*\n<!-- Sent from Reviewable.io -->\n"
   }
  ],
  "comments_url": "https://api.github.com/repos/adrianharabula/condr/issues/168/comments",
  "milestone": null,
  "quicklink": "adrianharabula/condr#168"
 },
 {
  "id": 233419360,
  "url": "https://github.com/adrianharabula/condr/issues/182",
  "title": "Fix CSRF Ajax Security Issue",
  "created_by": "adrianharabula",
  "created_at": "6/4/2017",
  "body": "Avem o problemă, dacă scoatem csrf-ul pentru callurile ajax, requesturile pot fi făcute şi din afara aplicaţiei şi aici apare o problemă.",
  "state": "open",
  "comments": [
   {
    "url": "https://api.github.com/repos/adrianharabula/condr/issues/comments/306025921",
    "html_url": "https://github.com/adrianharabula/condr/issues/182#issuecomment-306025921",
    "issue_url": "https://api.github.com/repos/adrianharabula/condr/issues/182",
    "id": 306025921,
    "user": {
     "login": "adrianharabula",
     "id": 2271038,
     "avatar_url": "https://avatars0.githubusercontent.com/u/2271038?v=3",
     "gravatar_id": "",
     "url": "https://api.github.com/users/adrianharabula",
     "html_url": "https://github.com/adrianharabula",
     "followers_url": "https://api.github.com/users/adrianharabula/followers",
     "following_url": "https://api.github.com/users/adrianharabula/following{/other_user}",
     "gists_url": "https://api.github.com/users/adrianharabula/gists{/gist_id}",
     "starred_url": "https://api.github.com/users/adrianharabula/starred{/owner}{/repo}",
     "subscriptions_url": "https://api.github.com/users/adrianharabula/subscriptions",
     "organizations_url": "https://api.github.com/users/adrianharabula/orgs",
     "repos_url": "https://api.github.com/users/adrianharabula/repos",
     "events_url": "https://api.github.com/users/adrianharabula/events{/privacy}",
     "received_events_url": "https://api.github.com/users/adrianharabula/received_events",
     "type": "User",
     "site_admin": false
    },
    "created_at": "6/4/2017",
    "updated_at": "2017-06-04T08:19:44Z",
    "body": "Sursa: https://laracasts.com/discuss/channels/general-discussion/how-do-i-make-an-ajax-request-to-a-controller-method"
   },
   {
    "url": "https://api.github.com/repos/adrianharabula/condr/issues/comments/306027022",
    "html_url": "https://github.com/adrianharabula/condr/issues/182#issuecomment-306027022",
    "issue_url": "https://api.github.com/repos/adrianharabula/condr/issues/182",
    "id": 306027022,
    "user": {
     "login": "adrianharabula",
     "id": 2271038,
     "avatar_url": "https://avatars0.githubusercontent.com/u/2271038?v=3",
     "gravatar_id": "",
     "url": "https://api.github.com/users/adrianharabula",
     "html_url": "https://github.com/adrianharabula",
     "followers_url": "https://api.github.com/users/adrianharabula/followers",
     "following_url": "https://api.github.com/users/adrianharabula/following{/other_user}",
     "gists_url": "https://api.github.com/users/adrianharabula/gists{/gist_id}",
     "starred_url": "https://api.github.com/users/adrianharabula/starred{/owner}{/repo}",
     "subscriptions_url": "https://api.github.com/users/adrianharabula/subscriptions",
     "organizations_url": "https://api.github.com/users/adrianharabula/orgs",
     "repos_url": "https://api.github.com/users/adrianharabula/repos",
     "events_url": "https://api.github.com/users/adrianharabula/events{/privacy}",
     "received_events_url": "https://api.github.com/users/adrianharabula/received_events",
     "type": "User",
     "site_admin": false
    },
    "created_at": "6/4/2017",
    "updated_at": "2017-06-04T08:45:32Z",
    "body": "Plus documentaţia oficială https://laravel.com/docs/5.4/csrf"
   }
  ],
  "comments_url": "https://api.github.com/repos/adrianharabula/condr/issues/182/comments",
  "milestone": null,
  "quicklink": "adrianharabula/condr#182"
 },
 {
  "id": 222401667,
  "url": "https://github.com/adrianharabula/condr/issues/14",
  "title": "Problemă cu baza de date, query-uri foarte încete (peste 1s) la conexiunea remote",
  "created_by": "adrianharabula",
  "created_at": "4/18/2017",
  "body": "",
  "state": "closed",
  "comments": [
   {
    "url": "https://api.github.com/repos/adrianharabula/condr/issues/comments/295149469",
    "html_url": "https://github.com/adrianharabula/condr/issues/14#issuecomment-295149469",
    "issue_url": "https://api.github.com/repos/adrianharabula/condr/issues/14",
    "id": 295149469,
    "user": {
     "login": "adrianharabula",
     "id": 2271038,
     "avatar_url": "https://avatars0.githubusercontent.com/u/2271038?v=3",
     "gravatar_id": "",
     "url": "https://api.github.com/users/adrianharabula",
     "html_url": "https://github.com/adrianharabula",
     "followers_url": "https://api.github.com/users/adrianharabula/followers",
     "following_url": "https://api.github.com/users/adrianharabula/following{/other_user}",
     "gists_url": "https://api.github.com/users/adrianharabula/gists{/gist_id}",
     "starred_url": "https://api.github.com/users/adrianharabula/starred{/owner}{/repo}",
     "subscriptions_url": "https://api.github.com/users/adrianharabula/subscriptions",
     "organizations_url": "https://api.github.com/users/adrianharabula/orgs",
     "repos_url": "https://api.github.com/users/adrianharabula/repos",
     "events_url": "https://api.github.com/users/adrianharabula/events{/privacy}",
     "received_events_url": "https://api.github.com/users/adrianharabula/received_events",
     "type": "User",
     "site_admin": false
    },
    "created_at": "4/19/2017",
    "updated_at": "2017-04-19T07:58:28Z",
    "body": "Posibil de la server, am recreat alte instanțe cu RAM 1024MB respectiv 4096MB, problema nu mai persistă dacă e suficient RAM pe mașină."
   }
  ],
  "comments_url": "https://api.github.com/repos/adrianharabula/condr/issues/14/comments",
  "milestone": "interfaţa web",
  "quicklink": "adrianharabula/condr#14"
 },
 {
  "id": 229817050,
  "url": "https://github.com/adrianharabula/condr/pull/95",
  "title": "working characteristic relationship",
  "created_by": "elis47",
  "created_at": "5/19/2017",
  "body": "\n\n<!-- Reviewable:start -->\nThis change is [<img src=\"https://reviewable.io/review_button.svg\" height=\"34\" align=\"absmiddle\" alt=\"Reviewable\"/>](https://reviewable.io/reviews/adrianharabula/condr/95)\n<!-- Reviewable:end -->\n",
  "state": "closed",
  "comments": [
   {
    "url": "https://api.github.com/repos/adrianharabula/condr/issues/comments/302641810",
    "html_url": "https://github.com/adrianharabula/condr/pull/95#issuecomment-302641810",
    "issue_url": "https://api.github.com/repos/adrianharabula/condr/issues/95",
    "id": 302641810,
    "user": {
     "login": "adrianharabula",
     "id": 2271038,
     "avatar_url": "https://avatars0.githubusercontent.com/u/2271038?v=3",
     "gravatar_id": "",
     "url": "https://api.github.com/users/adrianharabula",
     "html_url": "https://github.com/adrianharabula",
     "followers_url": "https://api.github.com/users/adrianharabula/followers",
     "following_url": "https://api.github.com/users/adrianharabula/following{/other_user}",
     "gists_url": "https://api.github.com/users/adrianharabula/gists{/gist_id}",
     "starred_url": "https://api.github.com/users/adrianharabula/starred{/owner}{/repo}",
     "subscriptions_url": "https://api.github.com/users/adrianharabula/subscriptions",
     "organizations_url": "https://api.github.com/users/adrianharabula/orgs",
     "repos_url": "https://api.github.com/users/adrianharabula/repos",
     "events_url": "https://api.github.com/users/adrianharabula/events{/privacy}",
     "received_events_url": "https://api.github.com/users/adrianharabula/received_events",
     "type": "User",
     "site_admin": false
    },
    "created_at": "5/19/2017",
    "updated_at": "2017-05-19T08:26:28Z",
    "body": "\n\n\n\nReviewed 3 of 5 files at r1, 11 of 11 files at r2.\nReview status: all files reviewed at latest revision, 5 unresolved discussions.\n\n---\n\n*[app/app/Http/Controllers/ProductsController.php, line 21 at r2](https://reviewable.io:443/reviews/adrianharabula/condr/95#-KkUk0RkjucoTYYnycG2:-KkUk0RkjucoTYYnycG3:b-b4nfrw) ([raw file](https://github.com/adrianharabula/condr/blob/2b8b9d1809aa97df3e23955c03bb14baf842af22/app/app/Http/Controllers/ProductsController.php#L21)):*\n> ```PHP\n>     $group = \\App\\Condrgroup::find(1);\n>     return view('viewProduct')->with('product', $product)\n>                               ->with('group', $group);\n> ```\n\naici o să ştergem asta\n\n---\n\n*[app/database/migrations/2017_05_07_000031_create_characterizables_table.php, line 16 at r2](https://reviewable.io:443/reviews/adrianharabula/condr/95#-KkUk640ollxXbyxtGPX:-KkUk641o2CUm8vpbFCS:b-5ei5ni) ([raw file](https://github.com/adrianharabula/condr/blob/2b8b9d1809aa97df3e23955c03bb14baf842af22/app/database/migrations/2017_05_07_000031_create_characterizables_table.php#L16)):*\n> ```PHP\n>     public function up()\n>     {\n>         Schema::create('characterizables', function (Blueprint $table) {\n> ```\n\nminunea!!!!\n\n---\n\n*[app/database/seeds/DatabaseSeeder.php, line 22 at r2](https://reviewable.io:443/reviews/adrianharabula/condr/95#-KkUljzQmtnTIAu8Y4QH:-KkUljzQmtnTIAu8Y4QI:b-myumth) ([raw file](https://github.com/adrianharabula/condr/blob/2b8b9d1809aa97df3e23955c03bb14baf842af22/app/database/seeds/DatabaseSeeder.php#L22)):*\n> ```PHP\n>         $this->call(ProductUserTableSeeder::class);\n>         $this->call(CharacteristicsTableSeeder::class);\n>         // $this->call(CharacterizablesTableSeeder::class);\n> ```\n\nyes, that was definitely not working\n\n---\n\n*[app/resources/views/viewProduct.blade.php, line 29 at r2](https://reviewable.io:443/reviews/adrianharabula/condr/95#-KkUo5g_QkoRE-rrQW1X:-KkUo5g_QkoRE-rrQW1Y:bpuqcgk) ([raw file](https://github.com/adrianharabula/condr/blob/2b8b9d1809aa97df3e23955c03bb14baf842af22/app/resources/views/viewProduct.blade.php#L29)):*\n> ```PHP\n> \n>           <h5>  {{ $group->characteristics[0]->name }}: {{ $group->characteristics[0]->values() }}</h5>\n> ```\n\nin sfarsit, working code!!!!\n\n---\n\n*[app/resources/views/viewProduct.blade.php, line 30 at r2](https://reviewable.io:443/reviews/adrianharabula/condr/95#-KkUo4wk4cXZVK59bOK6:-KkUo4wk4cXZVK59bOK7:b-yefn26) ([raw file](https://github.com/adrianharabula/condr/blob/2b8b9d1809aa97df3e23955c03bb14baf842af22/app/resources/views/viewProduct.blade.php#L30)):*\n> aracteristic->name }}: {{ $characteristic->values() }}</h5>\n>             @endforeach\n>  \n>           <h5>  {{ $group->characteristics[0]->name }}: {{ $group->characteristics[0]->values() }}</h5>\n>  \n\n---\n\n\n*Comments from [Reviewable](https://reviewable.io:443/reviews/adrianharabula/condr/95)*\n<!-- Sent from Reviewable.io -->\n"
   }
  ],
  "comments_url": "https://api.github.com/repos/adrianharabula/condr/issues/95/comments",
  "milestone": null,
  "quicklink": "adrianharabula/condr#95"
 },
 {
  "id": 231287084,
  "url": "https://github.com/adrianharabula/condr/issues/137",
  "title": "myproducts unequal column in row",
  "created_by": "adrianharabula",
  "created_at": "5/25/2017",
  "body": "",
  "state": "open",
  "comments": [],
  "comments_url": "https://api.github.com/repos/adrianharabula/condr/issues/137/comments",
  "milestone": null,
  "quicklink": "adrianharabula/condr#137"
 },
 {
  "id": 231064106,
  "url": "https://github.com/adrianharabula/condr/pull/128",
  "title": "stylized mygroups,mypreferences pages",
  "created_by": "elis47",
  "created_at": "5/24/2017",
  "body": "\n\n<!-- Reviewable:start -->\nThis change is [<img src=\"https://reviewable.io/review_button.svg\" height=\"34\" align=\"absmiddle\" alt=\"Reviewable\"/>](https://reviewable.io/reviews/adrianharabula/condr/128)\n<!-- Reviewable:end -->\n",
  "state": "closed",
  "comments": [
   {
    "url": "https://api.github.com/repos/adrianharabula/condr/issues/comments/303747974",
    "html_url": "https://github.com/adrianharabula/condr/pull/128#issuecomment-303747974",
    "issue_url": "https://api.github.com/repos/adrianharabula/condr/issues/128",
    "id": 303747974,
    "user": {
     "login": "adrianharabula",
     "id": 2271038,
     "avatar_url": "https://avatars0.githubusercontent.com/u/2271038?v=3",
     "gravatar_id": "",
     "url": "https://api.github.com/users/adrianharabula",
     "html_url": "https://github.com/adrianharabula",
     "followers_url": "https://api.github.com/users/adrianharabula/followers",
     "following_url": "https://api.github.com/users/adrianharabula/following{/other_user}",
     "gists_url": "https://api.github.com/users/adrianharabula/gists{/gist_id}",
     "starred_url": "https://api.github.com/users/adrianharabula/starred{/owner}{/repo}",
     "subscriptions_url": "https://api.github.com/users/adrianharabula/subscriptions",
     "organizations_url": "https://api.github.com/users/adrianharabula/orgs",
     "repos_url": "https://api.github.com/users/adrianharabula/repos",
     "events_url": "https://api.github.com/users/adrianharabula/events{/privacy}",
     "received_events_url": "https://api.github.com/users/adrianharabula/received_events",
     "type": "User",
     "site_admin": false
    },
    "created_at": "5/24/2017",
    "updated_at": "2017-05-24T14:50:16Z",
    "body": "\n\n\n\nReviewed 3 of 3 files at r1.\nReview status: all files reviewed at latest revision, all discussions resolved.\n\n---\n\n\n\n*Comments from [Reviewable](https://reviewable.io:443/reviews/adrianharabula/condr/128)*\n<!-- Sent from Reviewable.io -->\n"
   }
  ],
  "comments_url": "https://api.github.com/repos/adrianharabula/condr/issues/128/comments",
  "milestone": null,
  "quicklink": "adrianharabula/condr#128"
 },
 {
  "id": 230334487,
  "url": "https://github.com/adrianharabula/condr/pull/117",
  "title": "Semi automated characteristicstable seeder",
  "created_by": "adrianharabula",
  "created_at": "5/22/2017",
  "body": "\n\n<!-- Reviewable:start -->\nThis change is [<img src=\"https://reviewable.io/review_button.svg\" height=\"34\" align=\"absmiddle\" alt=\"Reviewable\"/>](https://reviewable.io/reviews/adrianharabula/condr/117)\n<!-- Reviewable:end -->\n",
  "state": "closed",
  "comments": [],
  "comments_url": "https://api.github.com/repos/adrianharabula/condr/issues/117/comments",
  "milestone": null,
  "quicklink": "adrianharabula/condr#117"
 },
 {
  "id": 230224137,
  "url": "https://github.com/adrianharabula/condr/issues/116",
  "title": "Redesign pagina products",
  "created_by": "adrianharabula",
  "created_at": "5/21/2017",
  "body": "Pagina cu produse arată zici că sunt grupuri:\r\n![image](https://cloud.githubusercontent.com/assets/2271038/26284692/11dc1fc2-3e4a-11e7-9ce4-8ce32e6f4231.png)\r\n\r\nAr trebui regândită. Surse de inspiraţie http://demo.simplcommerce.com/basic-phones\r\n\r\nAşa ceva arată muuuuult mai bine, chiar zici că sunt produse\r\n![image](https://cloud.githubusercontent.com/assets/2271038/26284699/31c39e64-3e4a-11e7-80f9-cbf2839bf971.png)\r\n",
  "state": "open",
  "comments": [
   {
    "url": "https://api.github.com/repos/adrianharabula/condr/issues/comments/303321803",
    "html_url": "https://github.com/adrianharabula/condr/issues/116#issuecomment-303321803",
    "issue_url": "https://api.github.com/repos/adrianharabula/condr/issues/116",
    "id": 303321803,
    "user": {
     "login": "adrianharabula",
     "id": 2271038,
     "avatar_url": "https://avatars0.githubusercontent.com/u/2271038?v=3",
     "gravatar_id": "",
     "url": "https://api.github.com/users/adrianharabula",
     "html_url": "https://github.com/adrianharabula",
     "followers_url": "https://api.github.com/users/adrianharabula/followers",
     "following_url": "https://api.github.com/users/adrianharabula/following{/other_user}",
     "gists_url": "https://api.github.com/users/adrianharabula/gists{/gist_id}",
     "starred_url": "https://api.github.com/users/adrianharabula/starred{/owner}{/repo}",
     "subscriptions_url": "https://api.github.com/users/adrianharabula/subscriptions",
     "organizations_url": "https://api.github.com/users/adrianharabula/orgs",
     "repos_url": "https://api.github.com/users/adrianharabula/repos",
     "events_url": "https://api.github.com/users/adrianharabula/events{/privacy}",
     "received_events_url": "https://api.github.com/users/adrianharabula/received_events",
     "type": "User",
     "site_admin": false
    },
    "created_at": "5/23/2017",
    "updated_at": "2017-05-23T08:06:56Z",
    "body": "Pentru a separa caracteristicile putem folosi asta https://stackoverflow.com/a/1125740"
   },
   {
    "url": "https://api.github.com/repos/adrianharabula/condr/issues/comments/303325272",
    "html_url": "https://github.com/adrianharabula/condr/issues/116#issuecomment-303325272",
    "issue_url": "https://api.github.com/repos/adrianharabula/condr/issues/116",
    "id": 303325272,
    "user": {
     "login": "adrianharabula",
     "id": 2271038,
     "avatar_url": "https://avatars0.githubusercontent.com/u/2271038?v=3",
     "gravatar_id": "",
     "url": "https://api.github.com/users/adrianharabula",
     "html_url": "https://github.com/adrianharabula",
     "followers_url": "https://api.github.com/users/adrianharabula/followers",
     "following_url": "https://api.github.com/users/adrianharabula/following{/other_user}",
     "gists_url": "https://api.github.com/users/adrianharabula/gists{/gist_id}",
     "starred_url": "https://api.github.com/users/adrianharabula/starred{/owner}{/repo}",
     "subscriptions_url": "https://api.github.com/users/adrianharabula/subscriptions",
     "organizations_url": "https://api.github.com/users/adrianharabula/orgs",
     "repos_url": "https://api.github.com/users/adrianharabula/repos",
     "events_url": "https://api.github.com/users/adrianharabula/events{/privacy}",
     "received_events_url": "https://api.github.com/users/adrianharabula/received_events",
     "type": "User",
     "site_admin": false
    },
    "created_at": "5/23/2017",
    "updated_at": "2017-05-23T08:17:12Z",
    "body": "pentru a selecta anumite caracteristici\r\n![image](https://cloud.githubusercontent.com/assets/2271038/26344745/5d2dfa8a-3fa9-11e7-9e6d-0f03af0141ca.png)\r\n"
   }
  ],
  "comments_url": "https://api.github.com/repos/adrianharabula/condr/issues/116/comments",
  "milestone": null,
  "quicklink": "adrianharabula/condr#116"
 },
 {
  "id": 229618860,
  "url": "https://github.com/adrianharabula/condr/pull/92",
  "title": "testing reviewable",
  "created_by": "adrianharabula",
  "created_at": "5/18/2017",
  "body": "\n\n<!-- Reviewable:start -->\nThis change is [<img src=\"https://reviewable.io/review_button.svg\" height=\"34\" align=\"absmiddle\" alt=\"Reviewable\"/>](https://reviewable.io/reviews/adrianharabula/condr/92)\n<!-- Reviewable:end -->\n",
  "state": "closed",
  "comments": [
   {
    "url": "https://api.github.com/repos/adrianharabula/condr/issues/comments/302362431",
    "html_url": "https://github.com/adrianharabula/condr/pull/92#issuecomment-302362431",
    "issue_url": "https://api.github.com/repos/adrianharabula/condr/issues/92",
    "id": 302362431,
    "user": {
     "login": "adrianharabula",
     "id": 2271038,
     "avatar_url": "https://avatars0.githubusercontent.com/u/2271038?v=3",
     "gravatar_id": "",
     "url": "https://api.github.com/users/adrianharabula",
     "html_url": "https://github.com/adrianharabula",
     "followers_url": "https://api.github.com/users/adrianharabula/followers",
     "following_url": "https://api.github.com/users/adrianharabula/following{/other_user}",
     "gists_url": "https://api.github.com/users/adrianharabula/gists{/gist_id}",
     "starred_url": "https://api.github.com/users/adrianharabula/starred{/owner}{/repo}",
     "subscriptions_url": "https://api.github.com/users/adrianharabula/subscriptions",
     "organizations_url": "https://api.github.com/users/adrianharabula/orgs",
     "repos_url": "https://api.github.com/users/adrianharabula/repos",
     "events_url": "https://api.github.com/users/adrianharabula/events{/privacy}",
     "received_events_url": "https://api.github.com/users/adrianharabula/received_events",
     "type": "User",
     "site_admin": false
    },
    "created_at": "5/18/2017",
    "updated_at": "2017-05-18T10:14:24Z",
    "body": "\n\n\n\n\n\n\n\n*[testing_reviewable, line 1 at r1](https://reviewable.io:443/reviews/adrianharabula/condr/92#-KkQ2ExPMe_mgbJjMYOY:-KkQ2ExPMe_mgbJjMYOZ:buagjxt) ([raw file](https://github.com/adrianharabula/condr/blob/af68f0ad2c35507a6ae1de58e8b8817cfec78bc0/testing_reviewable#L1)):*\n> ```\n> Hello world from reviewable;\n> ```\n\nthis works pretty well.\n\n---\n\n\n*Comments from [Reviewable](https://reviewable.io:443/reviews/adrianharabula/condr/92)*\n<!-- Sent from Reviewable.io -->\n"
   },
   {
    "url": "https://api.github.com/repos/adrianharabula/condr/issues/comments/302362751",
    "html_url": "https://github.com/adrianharabula/condr/pull/92#issuecomment-302362751",
    "issue_url": "https://api.github.com/repos/adrianharabula/condr/issues/92",
    "id": 302362751,
    "user": {
     "login": "adrianharabula",
     "id": 2271038,
     "avatar_url": "https://avatars0.githubusercontent.com/u/2271038?v=3",
     "gravatar_id": "",
     "url": "https://api.github.com/users/adrianharabula",
     "html_url": "https://github.com/adrianharabula",
     "followers_url": "https://api.github.com/users/adrianharabula/followers",
     "following_url": "https://api.github.com/users/adrianharabula/following{/other_user}",
     "gists_url": "https://api.github.com/users/adrianharabula/gists{/gist_id}",
     "starred_url": "https://api.github.com/users/adrianharabula/starred{/owner}{/repo}",
     "subscriptions_url": "https://api.github.com/users/adrianharabula/subscriptions",
     "organizations_url": "https://api.github.com/users/adrianharabula/orgs",
     "repos_url": "https://api.github.com/users/adrianharabula/repos",
     "events_url": "https://api.github.com/users/adrianharabula/events{/privacy}",
     "received_events_url": "https://api.github.com/users/adrianharabula/received_events",
     "type": "User",
     "site_admin": false
    },
    "created_at": "5/18/2017",
    "updated_at": "2017-05-18T10:15:45Z",
    "body": "\n\n\n\nReviewed 1 of 1 files at r1.\nReview status: all files reviewed at latest revision, 1 unresolved discussion.\n\n---\n\n\n\n*Comments from [Reviewable](https://reviewable.io:443/reviews/adrianharabula/condr/92)*\n<!-- Sent from Reviewable.io -->\n"
   },
   {
    "url": "https://api.github.com/repos/adrianharabula/condr/issues/comments/302363076",
    "html_url": "https://github.com/adrianharabula/condr/pull/92#issuecomment-302363076",
    "issue_url": "https://api.github.com/repos/adrianharabula/condr/issues/92",
    "id": 302363076,
    "user": {
     "login": "adrianharabula",
     "id": 2271038,
     "avatar_url": "https://avatars0.githubusercontent.com/u/2271038?v=3",
     "gravatar_id": "",
     "url": "https://api.github.com/users/adrianharabula",
     "html_url": "https://github.com/adrianharabula",
     "followers_url": "https://api.github.com/users/adrianharabula/followers",
     "following_url": "https://api.github.com/users/adrianharabula/following{/other_user}",
     "gists_url": "https://api.github.com/users/adrianharabula/gists{/gist_id}",
     "starred_url": "https://api.github.com/users/adrianharabula/starred{/owner}{/repo}",
     "subscriptions_url": "https://api.github.com/users/adrianharabula/subscriptions",
     "organizations_url": "https://api.github.com/users/adrianharabula/orgs",
     "repos_url": "https://api.github.com/users/adrianharabula/repos",
     "events_url": "https://api.github.com/users/adrianharabula/events{/privacy}",
     "received_events_url": "https://api.github.com/users/adrianharabula/received_events",
     "type": "User",
     "site_admin": false
    },
    "created_at": "5/18/2017",
    "updated_at": "2017-05-18T10:17:22Z",
    "body": "\n\n\n\n\n\n\n\n*[testing_reviewable, line 1 at r1](https://reviewable.io:443/reviews/adrianharabula/condr/92#-KkQ2ExPMe_mgbJjMYOY:-KkQ2wsGeotlslxlLAQs:b-896fix) ([raw file](https://github.com/adrianharabula/condr/blob/af68f0ad2c35507a6ae1de58e8b8817cfec78bc0/testing_reviewable#L1)):*\n<details><summary><i>Previously, adrianharabula (Adrian Harabula) wrote…</i></summary><blockquote>\n\nthis works pretty well.\n</blockquote></details>\n\nDone.\n\n---\n\n\n*Comments from [Reviewable](https://reviewable.io:443/reviews/adrianharabula/condr/92)*\n<!-- Sent from Reviewable.io -->\n"
   },
   {
    "url": "https://api.github.com/repos/adrianharabula/condr/issues/comments/302363444",
    "html_url": "https://github.com/adrianharabula/condr/pull/92#issuecomment-302363444",
    "issue_url": "https://api.github.com/repos/adrianharabula/condr/issues/92",
    "id": 302363444,
    "user": {
     "login": "adrianharabula",
     "id": 2271038,
     "avatar_url": "https://avatars0.githubusercontent.com/u/2271038?v=3",
     "gravatar_id": "",
     "url": "https://api.github.com/users/adrianharabula",
     "html_url": "https://github.com/adrianharabula",
     "followers_url": "https://api.github.com/users/adrianharabula/followers",
     "following_url": "https://api.github.com/users/adrianharabula/following{/other_user}",
     "gists_url": "https://api.github.com/users/adrianharabula/gists{/gist_id}",
     "starred_url": "https://api.github.com/users/adrianharabula/starred{/owner}{/repo}",
     "subscriptions_url": "https://api.github.com/users/adrianharabula/subscriptions",
     "organizations_url": "https://api.github.com/users/adrianharabula/orgs",
     "repos_url": "https://api.github.com/users/adrianharabula/repos",
     "events_url": "https://api.github.com/users/adrianharabula/events{/privacy}",
     "received_events_url": "https://api.github.com/users/adrianharabula/received_events",
     "type": "User",
     "site_admin": false
    },
    "created_at": "5/18/2017",
    "updated_at": "2017-05-18T10:19:02Z",
    "body": "\n\n\n\n\n\n\n\n*[testing_reviewable, line 1 at r1](https://reviewable.io:443/reviews/adrianharabula/condr/92#-KkQ2ExPMe_mgbJjMYOY:-KkQ3JotSFqy3Qg7Hms9:b-896fix) ([raw file](https://github.com/adrianharabula/condr/blob/af68f0ad2c35507a6ae1de58e8b8817cfec78bc0/testing_reviewable#L1)):*\n<details><summary><i>Previously, adrianharabula (Adrian Harabula) wrote…</i></summary><blockquote>\n\nDone.\n</blockquote></details>\n\nDone.\n\n---\n\n\n*Comments from [Reviewable](https://reviewable.io:443/reviews/adrianharabula/condr/92)*\n<!-- Sent from Reviewable.io -->\n"
   },
   {
    "url": "https://api.github.com/repos/adrianharabula/condr/issues/comments/302363525",
    "html_url": "https://github.com/adrianharabula/condr/pull/92#issuecomment-302363525",
    "issue_url": "https://api.github.com/repos/adrianharabula/condr/issues/92",
    "id": 302363525,
    "user": {
     "login": "adrianharabula",
     "id": 2271038,
     "avatar_url": "https://avatars0.githubusercontent.com/u/2271038?v=3",
     "gravatar_id": "",
     "url": "https://api.github.com/users/adrianharabula",
     "html_url": "https://github.com/adrianharabula",
     "followers_url": "https://api.github.com/users/adrianharabula/followers",
     "following_url": "https://api.github.com/users/adrianharabula/following{/other_user}",
     "gists_url": "https://api.github.com/users/adrianharabula/gists{/gist_id}",
     "starred_url": "https://api.github.com/users/adrianharabula/starred{/owner}{/repo}",
     "subscriptions_url": "https://api.github.com/users/adrianharabula/subscriptions",
     "organizations_url": "https://api.github.com/users/adrianharabula/orgs",
     "repos_url": "https://api.github.com/users/adrianharabula/repos",
     "events_url": "https://api.github.com/users/adrianharabula/events{/privacy}",
     "received_events_url": "https://api.github.com/users/adrianharabula/received_events",
     "type": "User",
     "site_admin": false
    },
    "created_at": "5/18/2017",
    "updated_at": "2017-05-18T10:19:22Z",
    "body": "\n\n\n\nReviewed 1 of 1 files at r1.\nReview status: all files reviewed at latest revision, 1 unresolved discussion.\n\n---\n\n\n\n*Comments from [Reviewable](https://reviewable.io:443/reviews/adrianharabula/condr/92)*\n<!-- Sent from Reviewable.io -->\n"
   },
   {
    "url": "https://api.github.com/repos/adrianharabula/condr/issues/comments/302529146",
    "html_url": "https://github.com/adrianharabula/condr/pull/92#issuecomment-302529146",
    "issue_url": "https://api.github.com/repos/adrianharabula/condr/issues/92",
    "id": 302529146,
    "user": {
     "login": "adrianharabula",
     "id": 2271038,
     "avatar_url": "https://avatars0.githubusercontent.com/u/2271038?v=3",
     "gravatar_id": "",
     "url": "https://api.github.com/users/adrianharabula",
     "html_url": "https://github.com/adrianharabula",
     "followers_url": "https://api.github.com/users/adrianharabula/followers",
     "following_url": "https://api.github.com/users/adrianharabula/following{/other_user}",
     "gists_url": "https://api.github.com/users/adrianharabula/gists{/gist_id}",
     "starred_url": "https://api.github.com/users/adrianharabula/starred{/owner}{/repo}",
     "subscriptions_url": "https://api.github.com/users/adrianharabula/subscriptions",
     "organizations_url": "https://api.github.com/users/adrianharabula/orgs",
     "repos_url": "https://api.github.com/users/adrianharabula/repos",
     "events_url": "https://api.github.com/users/adrianharabula/events{/privacy}",
     "received_events_url": "https://api.github.com/users/adrianharabula/received_events",
     "type": "User",
     "site_admin": false
    },
    "created_at": "5/18/2017",
    "updated_at": "2017-05-18T20:17:27Z",
    "body": "enough testing, let's start doing."
   }
  ],
  "comments_url": "https://api.github.com/repos/adrianharabula/condr/issues/92/comments",
  "milestone": null,
  "quicklink": "adrianharabula/condr#92"
 },
 {
  "id": 233417818,
  "url": "https://github.com/adrianharabula/condr/issues/181",
  "title": "Exemplu instrucţiuni foarte bune pentru aplicaţie",
  "created_by": "adrianharabula",
  "created_at": "6/4/2017",
  "body": "https://play.google.com/store/apps/details?id=com.visionsmarts.pic2shop\r\n\r\n> Point the camera at the barcode of a product (even if blurry) and instantly compare the prices at thousands of online and local retailers. Product information, user reviews, etc., are just one tap away! \r\n> \r\n> QUICK FACTS: \r\n> \r\n> - Supports all devices (camera scan, no accessory needed) even fixed-focus cameras\r\n> \r\n> - Online Stores: Amazon, eBay, Target, Walmart, Buy.com, Barnes & Noble, Best Buy, Capitol Supply, Computer World, CD Universe, Unbeatablesale.com, Ritz Camera, Office Depot, Sam's Club, Kmart, Walgreens, Sears, TigerDirect, eCost, NewEgg, Radio Shack, and thousands more (really!) \r\n> \r\n> -Local Stores: Walmart, Sears, Kmart, ToysRUs, BabiesRUs, Target, Staples, Nordstrom, Micro Center, Macy's, Lowe's, Home Depot, Best Buy, Radio Shack, etc. \r\n> \r\n> -QR codes: visit link, add contact to address book, etc. \r\n> \r\n> HOW IT WORKS: \r\n> \r\n> 1. Download the FREE pic2shop app and open it \r\n> 2. Point the camera at the barcode until the red line turns green (super fast!) \r\n> 3. Find out where the product is cheaper and save money. (Yeah…. It’s really that easy.) \r\n> 4. Each scan creates a webpage that you can share and access from any computer (not for QR codes) \r\n> \r\n> FEATURES: \r\n> \r\n> ALL DEVICES: Not just the latest models, scans barcodes on phones and tablets without autofocus cameras\r\n> ONLINE SEARCH: Thousands of online retailers help you get the best prices \r\n> LOCAL SEARCH: Don’t want to pay for shipping? We can tell you if the store down the street has it (US only - not all products) \r\n> LIBRARY SEARCH: Why pay when you can check things out? Pic2Shop searches local libraries for what you are interested in and will even tell you if it’s checked out (and when it’s due back!). \r\n> WISH: Add an item to Wishlist.com in one tap \r\n> SHARE: On Facebook, Twitter and many others \r\n> EMAIL: Send a link to the full results, or the last 20 scans to yourself or a friend via email \r\n> FAST: Identifies barcodes faster and more accurately, even if blurry \r\n> WEB FRIENDLY: The web sites of retailers are one tap away, without leaving the app \r\n> QR CODES: Even if they are difficult to read, blurry, skewed, etc. \r\n> \r\n> Watch real consumers trying pic2shop on YouTube : http://bit.ly/picshop \r\n> \r\n> If you like the new Pic2Shop, please tell your friends! Thank you for your support. \r\n> \r\n> ** Please report any problem to support-android@pic2shop.com **",
  "state": "open",
  "comments": [],
  "comments_url": "https://api.github.com/repos/adrianharabula/condr/issues/181/comments",
  "milestone": null,
  "quicklink": "adrianharabula/condr#181"
 },
 {
  "id": 228558980,
  "url": "https://github.com/adrianharabula/condr/issues/84",
  "title": "somehow prepare database for first time run",
  "created_by": "adrianharabula",
  "created_at": "5/14/2017",
  "body": "",
  "state": "closed",
  "comments": [
   {
    "url": "https://api.github.com/repos/adrianharabula/condr/issues/comments/301339830",
    "html_url": "https://github.com/adrianharabula/condr/issues/84#issuecomment-301339830",
    "issue_url": "https://api.github.com/repos/adrianharabula/condr/issues/84",
    "id": 301339830,
    "user": {
     "login": "adrianharabula",
     "id": 2271038,
     "avatar_url": "https://avatars0.githubusercontent.com/u/2271038?v=3",
     "gravatar_id": "",
     "url": "https://api.github.com/users/adrianharabula",
     "html_url": "https://github.com/adrianharabula",
     "followers_url": "https://api.github.com/users/adrianharabula/followers",
     "following_url": "https://api.github.com/users/adrianharabula/following{/other_user}",
     "gists_url": "https://api.github.com/users/adrianharabula/gists{/gist_id}",
     "starred_url": "https://api.github.com/users/adrianharabula/starred{/owner}{/repo}",
     "subscriptions_url": "https://api.github.com/users/adrianharabula/subscriptions",
     "organizations_url": "https://api.github.com/users/adrianharabula/orgs",
     "repos_url": "https://api.github.com/users/adrianharabula/repos",
     "events_url": "https://api.github.com/users/adrianharabula/events{/privacy}",
     "received_events_url": "https://api.github.com/users/adrianharabula/received_events",
     "type": "User",
     "site_admin": false
    },
    "created_at": "5/14/2017",
    "updated_at": "2017-05-14T21:04:26Z",
    "body": "We've got [these](https://github.com/adrianharabula/condr/tree/dd9bd093983f4465338372bb60e1b3018807bd4b/Dockerfiles/oracledb/sqlscripts) scripts working on first time initialization.\r\n\r\nWhat we need to do is to find a way to make migration run automatically on first run. Not important, but it would be nice to find a way.\r\n\r\nThat would automate just everything!!!!"
   },
   {
    "url": "https://api.github.com/repos/adrianharabula/condr/issues/comments/301344707",
    "html_url": "https://github.com/adrianharabula/condr/issues/84#issuecomment-301344707",
    "issue_url": "https://api.github.com/repos/adrianharabula/condr/issues/84",
    "id": 301344707,
    "user": {
     "login": "adrianharabula",
     "id": 2271038,
     "avatar_url": "https://avatars0.githubusercontent.com/u/2271038?v=3",
     "gravatar_id": "",
     "url": "https://api.github.com/users/adrianharabula",
     "html_url": "https://github.com/adrianharabula",
     "followers_url": "https://api.github.com/users/adrianharabula/followers",
     "following_url": "https://api.github.com/users/adrianharabula/following{/other_user}",
     "gists_url": "https://api.github.com/users/adrianharabula/gists{/gist_id}",
     "starred_url": "https://api.github.com/users/adrianharabula/starred{/owner}{/repo}",
     "subscriptions_url": "https://api.github.com/users/adrianharabula/subscriptions",
     "organizations_url": "https://api.github.com/users/adrianharabula/orgs",
     "repos_url": "https://api.github.com/users/adrianharabula/repos",
     "events_url": "https://api.github.com/users/adrianharabula/events{/privacy}",
     "received_events_url": "https://api.github.com/users/adrianharabula/received_events",
     "type": "User",
     "site_admin": false
    },
    "created_at": "5/15/2017",
    "updated_at": "2017-05-14T22:36:40Z",
    "body": "Avem install instructions aici https://github.com/adrianharabula/condr/wiki/Install-instructions. Nu cred că voi mai continua cu automatizarea pentru că nu îi mai văd rostul. Dacă va fi cazul voi redeschide issueul."
   }
  ],
  "comments_url": "https://api.github.com/repos/adrianharabula/condr/issues/84/comments",
  "milestone": null,
  "quicklink": "adrianharabula/condr#84"
 },
 {
  "id": 233390399,
  "url": "https://github.com/adrianharabula/condr/issues/178",
  "title": "Problem at my products page",
  "created_by": "Madalina-Buza",
  "created_at": "6/3/2017",
  "body": "The products doesn't keep the caractheristics\r\n![c](https://cloud.githubusercontent.com/assets/22739950/26756481/fa16a436-48ab-11e7-9d25-1ce170af90da.JPG)\r\n",
  "state": "closed",
  "comments": [
   {
    "url": "https://api.github.com/repos/adrianharabula/condr/issues/comments/306031213",
    "html_url": "https://github.com/adrianharabula/condr/issues/178#issuecomment-306031213",
    "issue_url": "https://api.github.com/repos/adrianharabula/condr/issues/178",
    "id": 306031213,
    "user": {
     "login": "elis47",
     "id": 13468137,
     "avatar_url": "https://avatars2.githubusercontent.com/u/13468137?v=3",
     "gravatar_id": "",
     "url": "https://api.github.com/users/elis47",
     "html_url": "https://github.com/elis47",
     "followers_url": "https://api.github.com/users/elis47/followers",
     "following_url": "https://api.github.com/users/elis47/following{/other_user}",
     "gists_url": "https://api.github.com/users/elis47/gists{/gist_id}",
     "starred_url": "https://api.github.com/users/elis47/starred{/owner}{/repo}",
     "subscriptions_url": "https://api.github.com/users/elis47/subscriptions",
     "organizations_url": "https://api.github.com/users/elis47/orgs",
     "repos_url": "https://api.github.com/users/elis47/repos",
     "events_url": "https://api.github.com/users/elis47/events{/privacy}",
     "received_events_url": "https://api.github.com/users/elis47/received_events",
     "type": "User",
     "site_admin": false
    },
    "created_at": "6/4/2017",
    "updated_at": "2017-06-04T10:18:13Z",
    "body": "done"
   }
  ],
  "comments_url": "https://api.github.com/repos/adrianharabula/condr/issues/178/comments",
  "milestone": null,
  "quicklink": "adrianharabula/condr#178"
 },
 {
  "id": 231612300,
  "url": "https://github.com/adrianharabula/condr/issues/144",
  "title": "Weekend Sprint",
  "created_by": "adrianharabula",
  "created_at": "5/26/2017",
  "body": "Nu prea mai avem timp, practic mai sunt 3 zile până la prezentare:\r\n- [x] vineri\r\n- [x] sâmbătă\r\n- [ ] duminică\r\n\r\nCe mai putem face acum pe ultima sută de metri e finalizăm ceea ce am început. Vom renunţa în totalitate să mai adăugam funcţionalităţi iar ceea ce nu e funcţional/complet vom renunţa de asemenea.\r\n\r\nScopul în aceste zile este să livrăm ceva cu minim de funcţionalităţi, dar funcţional.\r\n\r\nAcel minim demo va putea face următoarele:\r\nIntri pe site, cauţi un produs, îi vezi caracteristicile, votezi caracteristica.\r\n\r\nŞi atât.\r\n\r\nSă vedem cum aducem siteul în această stare, pentru că şi doar pentru atât sunt multe lucruri de făcut.\r\n\r\nPe lângă asta va trebui să adunăm tot ce avem prin issues, projects, pe wiki şi multe altele şi să le punem în documentaţie. Documentaţia va fi [aici](https://docs.condr.me)\r\n\r\n- articole cu bucăţi de cod din proiectul nostru (marea majoritate le avem deja scrise în issues)\r\n- manualul utilizatorului\r\n- manualul programatorului\r\n\r\nLuni vom avea şi o variantă printată care va cuprinde bucăţi din documentaţia online.\r\n\r\nPe scurt, acesta e planul pe zilele ce urmează.\r\n\r\nCine nu are chef de lucru, am rugămintea să stea deoparte. E liber să facă ce vrea dar să nu strice cheful de lucru şi la cei din jur.\r\n",
  "state": "open",
  "comments": [],
  "comments_url": "https://api.github.com/repos/adrianharabula/condr/issues/144/comments",
  "milestone": null,
  "quicklink": "adrianharabula/condr#144"
 },
 {
  "id": 229751772,
  "url": "https://github.com/adrianharabula/condr/pull/94",
  "title": "incomplete code for products",
  "created_by": "elis47",
  "created_at": "5/18/2017",
  "body": "\n\n<!-- Reviewable:start -->\nThis change is [<img src=\"https://reviewable.io/review_button.svg\" height=\"34\" align=\"absmiddle\" alt=\"Reviewable\"/>](https://reviewable.io/reviews/adrianharabula/condr/94)\n<!-- Reviewable:end -->\n",
  "state": "closed",
  "comments": [
   {
    "url": "https://api.github.com/repos/adrianharabula/condr/issues/comments/302528310",
    "html_url": "https://github.com/adrianharabula/condr/pull/94#issuecomment-302528310",
    "issue_url": "https://api.github.com/repos/adrianharabula/condr/issues/94",
    "id": 302528310,
    "user": {
     "login": "adrianharabula",
     "id": 2271038,
     "avatar_url": "https://avatars0.githubusercontent.com/u/2271038?v=3",
     "gravatar_id": "",
     "url": "https://api.github.com/users/adrianharabula",
     "html_url": "https://github.com/adrianharabula",
     "followers_url": "https://api.github.com/users/adrianharabula/followers",
     "following_url": "https://api.github.com/users/adrianharabula/following{/other_user}",
     "gists_url": "https://api.github.com/users/adrianharabula/gists{/gist_id}",
     "starred_url": "https://api.github.com/users/adrianharabula/starred{/owner}{/repo}",
     "subscriptions_url": "https://api.github.com/users/adrianharabula/subscriptions",
     "organizations_url": "https://api.github.com/users/adrianharabula/orgs",
     "repos_url": "https://api.github.com/users/adrianharabula/repos",
     "events_url": "https://api.github.com/users/adrianharabula/events{/privacy}",
     "received_events_url": "https://api.github.com/users/adrianharabula/received_events",
     "type": "User",
     "site_admin": false
    },
    "created_at": "5/18/2017",
    "updated_at": "2017-05-18T20:14:01Z",
    "body": "\n\n\n\nReviewed 15 of 15 files at r1.\nReview status: all files reviewed at latest revision, 3 unresolved discussions.\n\n---\n\n*[app/resources/views/products.blade.php, line 7 at r1](https://reviewable.io:443/reviews/adrianharabula/condr/94#-KkSAwAcqADa5dYEq4Z9:-KkSAwAcqADa5dYEq4ZA:b-jexcxe) ([raw file](https://github.com/adrianharabula/condr/blob/98360f46d460f7dba0533b6e35a6217d2518616f/app/resources/views/products.blade.php#L7)):*\n> ```PHP\n> \n> @section('content')\n> <link href=\"/Assets/css/products.css\" rel=\"stylesheet\">\n> ```\n\ncine naiba o fi pus linia asta? :))\n\n---\n\n*[app/resources/views/products.blade.php, line 68 at r1](https://reviewable.io:443/reviews/adrianharabula/condr/94#-KkSAizkASaafxvNancE:-KkSAizl-upfccQLE7ub:bwi5k2y) ([raw file](https://github.com/adrianharabula/condr/blob/cf564bf3b9981a855f3894df68f97ea2687fea79/app/resources/views/products.blade.php#L68)):*\n> ```PHP\n> @push('styles')\n> <link rel=\"stylesheet\" type=\"text/css\" href=\"{{ asset('/css/products.css') }}\">\n> @endpush\n> ```\n\naşa da, aşa se pune un css custom pentru o pagină anume\n\n---\n\n*[app/resources/views/layouts/app.blade.php, line 18 at r1](https://reviewable.io:443/reviews/adrianharabula/condr/94#-KkSAZEGgSw_mHyOkMPA:-KkSAZEGgSw_mHyOkMPB:b228hjx) ([raw file](https://github.com/adrianharabula/condr/blob/cf564bf3b9981a855f3894df68f97ea2687fea79/app/resources/views/layouts/app.blade.php#L18)):*\n> ```PHP\n>     <link rel=\"stylesheet\" type=\"text/css\" href=\"{{ asset('/css/custom.css') }}\">\n>     <link rel=\"stylesheet\" type=\"text/css\" href=\"{{ asset('/css/responsive.css') }}\">\n>     <link rel=\"stylesheet\" type=\"text/css\" href=\"{{ asset('/css/products.css') }}\">\n> ```\n\nstylesheets adiţionale adăugăm doar cu push, ca mai sus.\n\n---\n\n\n*Comments from [Reviewable](https://reviewable.io:443/reviews/adrianharabula/condr/94)*\n<!-- Sent from Reviewable.io -->\n"
   }
  ],
  "comments_url": "https://api.github.com/repos/adrianharabula/condr/issues/94/comments",
  "milestone": null,
  "quicklink": "adrianharabula/condr#94"
 },
 {
  "id": 230178798,
  "url": "https://github.com/adrianharabula/condr/pull/106",
  "title": "Updates webhook code and other server related changes",
  "created_by": "adrianharabula",
  "created_at": "5/20/2017",
  "body": "\n\n<!-- Reviewable:start -->\nThis change is [<img src=\"https://reviewable.io/review_button.svg\" height=\"34\" align=\"absmiddle\" alt=\"Reviewable\"/>](https://reviewable.io/reviews/adrianharabula/condr/106)\n<!-- Reviewable:end -->\n",
  "state": "closed",
  "comments": [
   {
    "url": "https://api.github.com/repos/adrianharabula/condr/issues/comments/302898732",
    "html_url": "https://github.com/adrianharabula/condr/pull/106#issuecomment-302898732",
    "issue_url": "https://api.github.com/repos/adrianharabula/condr/issues/106",
    "id": 302898732,
    "user": {
     "login": "adrianharabula",
     "id": 2271038,
     "avatar_url": "https://avatars0.githubusercontent.com/u/2271038?v=3",
     "gravatar_id": "",
     "url": "https://api.github.com/users/adrianharabula",
     "html_url": "https://github.com/adrianharabula",
     "followers_url": "https://api.github.com/users/adrianharabula/followers",
     "following_url": "https://api.github.com/users/adrianharabula/following{/other_user}",
     "gists_url": "https://api.github.com/users/adrianharabula/gists{/gist_id}",
     "starred_url": "https://api.github.com/users/adrianharabula/starred{/owner}{/repo}",
     "subscriptions_url": "https://api.github.com/users/adrianharabula/subscriptions",
     "organizations_url": "https://api.github.com/users/adrianharabula/orgs",
     "repos_url": "https://api.github.com/users/adrianharabula/repos",
     "events_url": "https://api.github.com/users/adrianharabula/events{/privacy}",
     "received_events_url": "https://api.github.com/users/adrianharabula/received_events",
     "type": "User",
     "site_admin": false
    },
    "created_at": "5/20/2017",
    "updated_at": "2017-05-20T21:03:58Z",
    "body": "\n\n\n\nReviewed 10 of 10 files at r1.\nReview status: all files reviewed at latest revision, 1 unresolved discussion.\n\n---\n\n*[app/.gitignore, line 11 at r1](https://reviewable.io:443/reviews/adrianharabula/condr/106#-Kkbey03M6qkmXpJeKry:-Kkbey04fWNFv5sIfc65:b-z2dscf) ([raw file](https://github.com/adrianharabula/condr/blob/0f5de9af03d74b22727d8ac79484ac0df12fc8fe/app/.gitignore#L11)):*\n> ```\n> .env\n> composer.phar\n> hicoria_rsa\n> ```\n\nthis needs to be deleted\n\n---\n\n\n*Comments from [Reviewable](https://reviewable.io:443/reviews/adrianharabula/condr/106)*\n<!-- Sent from Reviewable.io -->\n"
   }
  ],
  "comments_url": "https://api.github.com/repos/adrianharabula/condr/issues/106/comments",
  "milestone": null,
  "quicklink": "adrianharabula/condr#106"
 },
 {
  "id": 231170843,
  "url": "https://github.com/adrianharabula/condr/pull/132",
  "title": "fix",
  "created_by": "adrianharabula",
  "created_at": "5/24/2017",
  "body": "\n\n<!-- Reviewable:start -->\nThis change is [<img src=\"https://reviewable.io/review_button.svg\" height=\"34\" align=\"absmiddle\" alt=\"Reviewable\"/>](https://reviewable.io/reviews/adrianharabula/condr/132)\n<!-- Reviewable:end -->\n",
  "state": "closed",
  "comments": [],
  "comments_url": "https://api.github.com/repos/adrianharabula/condr/issues/132/comments",
  "milestone": null,
  "quicklink": "adrianharabula/condr#132"
 },
 {
  "id": 231860493,
  "url": "https://github.com/adrianharabula/condr/issues/149",
  "title": "Is there a way to automatically import new products with characteristics?",
  "created_by": "adrianharabula",
  "created_at": "5/28/2017",
  "body": "When a product is not found, can we search it and import it automatically?\r\n\r\nAPI-uri disponibile am avea:\r\n\r\n- http://www.upcitemdb.com\r\n- https://upcdatabase.org\r\n\r\nExemplu răspuns upcitemdb:\r\nRequest url: https://api.upcitemdb.com/prod/trial/lookup?upc=885909918188\r\nResponse body:\r\n```json\r\n{\r\n  \"code\": \"OK\",\r\n  \"total\": 1,\r\n  \"offset\": 0,\r\n  \"items\": [\r\n    {\r\n      \"ean\": \"0885909918188\",\r\n      \"title\": \"Apple MacBook Pro 13.3&quot; Retina Display Notebook Computer 2.7GHz Dual-core Intel Core i5 (Broadwell) 8GB DDR3 RAM 256GB PCIe Flash Storage (Early 2015)\",\r\n      \"description\": \"A Spectacular display is just the beginning   A groundbreaking Retina display. A new force-sensing trackpad. All-flash architecture. Powerful dual-core and quad-core Intel processors. Together, these features take the notebook to a new level of performanc\",\r\n      \"upc\": \"885909918188\",\r\n      \"brand\": \"Apple\",\r\n      \"model\": \"MF840LL/A\",\r\n      \"color\": \"Silver\",\r\n      \"size\": \"13.3in. Retin A Display\",\r\n      \"dimension\": \"\",\r\n      \"weight\": \"\",\r\n      \"currency\": \"\",\r\n      \"lowest_recorded_price\": 250,\r\n      \"images\": [\r\n        \"http://images.highspeedbackbone.net/SKUimages/large/40300998_vmain01_at_mn_4719591.jpg\",\r\n        \"https://i5.walmartimages.com/asr/19d6cafd-e520-4a6f-b6c3-3ddcbc2cbfe5_1.b191d88d51a33125c7334c23ccafd17c.jpeg?odnHeight=450&odnWidth=450&odnBg=ffffff\",\r\n        \"http://img.bbystatic.com/BestBuy_US/images/products/8532/8532029_sc.jpg\",\r\n        \"http://img1.r10.io/PIC/100026633/0/1/250/100026633.jpg\",\r\n        \"http://images.frys.com/art/product/300x300/8408658.01.prod.jpg\",\r\n        \"http://image1.cc-inc.com/prod/13446000/13446712_xlg.jpg\",\r\n        \"http://images.qvc.com/is/image/e/03/e282303.001?$uslarge$\",\r\n        \"http://images10.newegg.com/ProductImageCompressAll200/A5E6_1_20150416344022063.jpg\",\r\n        \"http://www.adorama.com/images/large/ACMF840LLA.JPG\",\r\n        \"http://images.prosperentcdn.com/images/250x250/content.abt.com/media/images/products/l_MF841LLA.jpg\"\r\n      ],\r\n      \"offers\": [\r\n        {\r\n          \"merchant\": \"Abt\",\r\n          \"domain\": \"abt.com\",\r\n          \"title\": \"Apple MacBook Pro 13.3\\\"\\\" With Retina Display 2.7GHz Intel Core i5 Laptop Computer\",\r\n          \"currency\": \"\",\r\n          \"list_price\": \"\",\r\n          \"price\": 1463.7,\r\n          \"shipping\": \"\",\r\n          \"condition\": \"New\",\r\n          \"availability\": \"\",\r\n          \"link\": \"http://www.upcitemdb.com/norob/alink/?id=u2s233230363b4d4y2&tid=1&seq=1495966973&plt=a91fdcbd73c8bd4e60a9714aeee31a9d\",\r\n          \"updated_t\": 1465780889\r\n        },\r\n        {\r\n          \"merchant\": \"Adorama\",\r\n          \"domain\": \"adorama.com\",\r\n          \"title\": \"Apple MacBook Pro 13.3&quot; Retina Display Notebook Computer 2.7GHz Dual-core Intel Core i5 (Broadwell) 8GB DDR3 RAM 256GB PCIe Flash Storage (Early 2015)\",\r\n          \"currency\": \"\",\r\n          \"list_price\": \"\",\r\n          \"price\": 1399,\r\n          \"shipping\": \"Free Shipping\",\r\n          \"condition\": \"New\",\r\n          \"availability\": \"\",\r\n          \"link\": \"http://www.upcitemdb.com/norob/alink/?id=u2q2y2t20333f4d4v2&tid=1&seq=1495966973&plt=3a991c30da14501f7312723dad5d133c\",\r\n          \"updated_t\": 1474863552\r\n        },\r\n        {\r\n          \"merchant\": \"Newegg.com\",\r\n          \"domain\": \"newegg.com\",\r\n          \"title\": \"Apple MacBook Pro Core i5 2.7GHz (Broadwell) 256GB SSD 8GB 13.3\\\" Retina (2560x1600) BT Mac OS X 10.10 Yosemite FaceTime Camera (Early 2015)\",\r\n          \"currency\": \"\",\r\n          \"list_price\": \"\",\r\n          \"price\": 1400,\r\n          \"shipping\": \"19.99\",\r\n          \"condition\": \"New\",\r\n          \"availability\": \"\",\r\n          \"link\": \"http://www.upcitemdb.com/norob/alink/?id=v2p213x2z213e4d4v2&tid=1&seq=1495966973&plt=deb4f6650100517f14a271418d220b45\",\r\n          \"updated_t\": 1479210487\r\n        },\r\n        {\r\n          \"merchant\": \"QVC.com\",\r\n          \"domain\": \"qvc.com\",\r\n          \"title\": \"Apple 13\\\" MacBook Pro - Core i5, 8GB RAM, 256GB SSD & Software\",\r\n          \"currency\": \"\",\r\n          \"list_price\": 2449.96,\r\n          \"price\": 2229.96,\r\n          \"shipping\": \"26.22\",\r\n          \"condition\": \"New\",\r\n          \"availability\": \"\",\r\n          \"link\": \"http://www.upcitemdb.com/norob/alink/?id=u2q213u2w21394c4z2&tid=1&seq=1495966973&plt=40ad7a815d023aff6248c1274a3e0047\",\r\n          \"updated_t\": 1495194894\r\n        },\r\n        {\r\n          \"merchant\": \"MacMall\",\r\n          \"domain\": \"macmall.com\",\r\n          \"title\": \"Apple MF840LL/A 13.3 MacBook Pro with Retina display  Dual-core Intel Core i5 2.7GHz (5th generation processor)  8GB RAM  256GB PCIe-based flash storage  Intel\",\r\n          \"currency\": \"\",\r\n          \"list_price\": 1499,\r\n          \"price\": 1449,\r\n          \"shipping\": \"0\",\r\n          \"condition\": \"New\",\r\n          \"availability\": \"\",\r\n          \"link\": \"http://www.upcitemdb.com/norob/alink/?id=u2q2y2u203y2a484s2&tid=1&seq=1495966973&plt=05ee68a4c8840f1d1d98683c2b4fd5ea\",\r\n          \"updated_t\": 1493828651\r\n        },\r\n        {\r\n          \"merchant\": \"Frys Electronics\",\r\n          \"domain\": \"frys.com\",\r\n          \"title\": \"NEW! Apple 13.3\\\" MacBook Pro with Retina display, Dual-core Intel Core i5 2.7GHz (5th generation processor), 8GB RAM, 256GB PCIe-based flash storage, Intel Iris Graphics 6100, Two Thunderbolt 2 ports, 802.11ac Wi-Fi, 10 hours of battery life, OS X Yosemit\",\r\n          \"currency\": \"\",\r\n          \"list_price\": \"\",\r\n          \"price\": 826.2,\r\n          \"shipping\": \"\",\r\n          \"condition\": \"New\",\r\n          \"availability\": \"\",\r\n          \"link\": \"http://www.upcitemdb.com/norob/alink/?id=u2r2y2u2w2z29454u2&tid=1&seq=1495966973&plt=71b0016c76923334976e1e1276fcb654\",\r\n          \"updated_t\": 1488643982\r\n        },\r\n        {\r\n          \"merchant\": \"Rakuten(Buy.com)\",\r\n          \"domain\": \"rakuten.com\",\r\n          \"title\": \"Apple MacBook Pro 13-inch - Retina 2.7Ghz 8GB 256GB - Mar 2015 / MF840LL/A Apple MacBook Pro MF840LL/A 13.3-Inch Laptop with Retina Display (256 GB) NEWEST VERSION\",\r\n          \"currency\": \"\",\r\n          \"list_price\": \"\",\r\n          \"price\": 1456.39,\r\n          \"shipping\": \"Free Shipping\",\r\n          \"condition\": \"New\",\r\n          \"availability\": \"Out of Stock\",\r\n          \"link\": \"http://www.upcitemdb.com/norob/alink/?id=u2q2z2x233z2d454r2&tid=1&seq=1495966973&plt=99f13618f01e1dff11e4be71651ba804\",\r\n          \"updated_t\": 1495830797\r\n        },\r\n        {\r\n          \"merchant\": \"Best Buy\",\r\n          \"domain\": \"bestbuy.com\",\r\n          \"title\": \"Apple - Macbook Pro With Retina Display (latest Model) - 13.3\\\" Display - 8gb Memory - 256gb Flash Storage - Silver\",\r\n          \"currency\": \"\",\r\n          \"list_price\": \"\",\r\n          \"price\": 1499.99,\r\n          \"shipping\": \"\",\r\n          \"condition\": \"New\",\r\n          \"availability\": \"\",\r\n          \"link\": \"http://www.upcitemdb.com/norob/alink/?id=u2q2y2y243z2a494t2&tid=1&seq=1495966973&plt=675f0e0e62217e008130da95bf5559c4\",\r\n          \"updated_t\": 1486163626\r\n        },\r\n        {\r\n          \"merchant\": \"Wal-Mart.com\",\r\n          \"domain\": \"walmart.com\",\r\n          \"title\": \"Apple MacBook Pro 13\\\" Retina Display MF840LLA Intel Core i5 2.7GHz 8GB 256GB SSD\",\r\n          \"currency\": \"\",\r\n          \"list_price\": \"\",\r\n          \"price\": 2499.99,\r\n          \"shipping\": \"Free Shipping\",\r\n          \"condition\": \"New\",\r\n          \"availability\": \"Out of Stock\",\r\n          \"link\": \"http://www.upcitemdb.com/norob/alink/?id=u2r2x2v223z264d4u2&tid=1&seq=1495966973&plt=68d38043ead4b8c58b21e94c52f8bf48\",\r\n          \"updated_t\": 1495839438\r\n        },\r\n        {\r\n          \"merchant\": \"TigerDirect\",\r\n          \"domain\": \"tigerdirect.com\",\r\n          \"title\": \"Apple MacBook Pro - MF840LL/A\",\r\n          \"currency\": \"\",\r\n          \"list_price\": \"\",\r\n          \"price\": 1494,\r\n          \"shipping\": \"\",\r\n          \"condition\": \"New\",\r\n          \"availability\": \"\",\r\n          \"link\": \"http://www.upcitemdb.com/norob/alink/?id=v2p24323y2637464s2&tid=1&seq=1495966973&plt=66b097fc123d469aeb62b2848a4808f0\",\r\n          \"updated_t\": 1495919811\r\n        },\r\n        {\r\n          \"merchant\": \"Blinq.com\",\r\n          \"domain\": \"blinq.com\",\r\n          \"title\": \"Apple MacBook Pro 13.3in Laptop i5 3.1GHz 8GB 512GB Mac OS X (MF843LL/A)\",\r\n          \"currency\": \"\",\r\n          \"list_price\": \"\",\r\n          \"price\": 1510.39,\r\n          \"shipping\": \"\",\r\n          \"condition\": \"New\",\r\n          \"availability\": \"\",\r\n          \"link\": \"http://www.upcitemdb.com/norob/alink/?id=u2x2531323y2c464x2&tid=1&seq=1495966973&plt=0124fecae18fb0c7ba7597c53ba0280c\",\r\n          \"updated_t\": 1478056130\r\n        },\r\n        {\r\n          \"merchant\": \"Newegg Business\",\r\n          \"domain\": \"neweggbusiness.com\",\r\n          \"title\": \"Apple MacBook Pro Core i5 2.7GHz (Broadwell) 256GB SSD 8GB 13.3\\\" Retina (2560x1600) BT Mac OS X 10.10 Yosemite FaceTime Camera (Early 2015)\",\r\n          \"currency\": \"\",\r\n          \"list_price\": \"\",\r\n          \"price\": 1527.69,\r\n          \"shipping\": \"Free Shipping\",\r\n          \"condition\": \"New\",\r\n          \"availability\": \"Out of Stock\",\r\n          \"link\": \"http://www.upcitemdb.com/norob/alink/?id=v2o263v2y2337464z2&tid=1&seq=1495966973&plt=4a640983f6c43696ba10ec5c19027b3b\",\r\n          \"updated_t\": 1495894981\r\n        }\r\n      ],\r\n      \"elid\": \"152538538811\"\r\n    }\r\n  ]\r\n}\r\n```",
  "state": "open",
  "comments": [
   {
    "url": "https://api.github.com/repos/adrianharabula/condr/issues/comments/304505810",
    "html_url": "https://github.com/adrianharabula/condr/issues/149#issuecomment-304505810",
    "issue_url": "https://api.github.com/repos/adrianharabula/condr/issues/149",
    "id": 304505810,
    "user": {
     "login": "adrianharabula",
     "id": 2271038,
     "avatar_url": "https://avatars0.githubusercontent.com/u/2271038?v=3",
     "gravatar_id": "",
     "url": "https://api.github.com/users/adrianharabula",
     "html_url": "https://github.com/adrianharabula",
     "followers_url": "https://api.github.com/users/adrianharabula/followers",
     "following_url": "https://api.github.com/users/adrianharabula/following{/other_user}",
     "gists_url": "https://api.github.com/users/adrianharabula/gists{/gist_id}",
     "starred_url": "https://api.github.com/users/adrianharabula/starred{/owner}{/repo}",
     "subscriptions_url": "https://api.github.com/users/adrianharabula/subscriptions",
     "organizations_url": "https://api.github.com/users/adrianharabula/orgs",
     "repos_url": "https://api.github.com/users/adrianharabula/repos",
     "events_url": "https://api.github.com/users/adrianharabula/events{/privacy}",
     "received_events_url": "https://api.github.com/users/adrianharabula/received_events",
     "type": "User",
     "site_admin": false
    },
    "created_at": "5/28/2017",
    "updated_at": "2017-05-28T10:36:53Z",
    "body": "Pentru a căuta upc code pentru un produs putem folosi\r\n\r\n- https://www.barcodelookup.com doar că preţurile încep de la 99$ pe lună :))"
   },
   {
    "url": "https://api.github.com/repos/adrianharabula/condr/issues/comments/304551614",
    "html_url": "https://github.com/adrianharabula/condr/issues/149#issuecomment-304551614",
    "issue_url": "https://api.github.com/repos/adrianharabula/condr/issues/149",
    "id": 304551614,
    "user": {
     "login": "adrianharabula",
     "id": 2271038,
     "avatar_url": "https://avatars0.githubusercontent.com/u/2271038?v=3",
     "gravatar_id": "",
     "url": "https://api.github.com/users/adrianharabula",
     "html_url": "https://github.com/adrianharabula",
     "followers_url": "https://api.github.com/users/adrianharabula/followers",
     "following_url": "https://api.github.com/users/adrianharabula/following{/other_user}",
     "gists_url": "https://api.github.com/users/adrianharabula/gists{/gist_id}",
     "starred_url": "https://api.github.com/users/adrianharabula/starred{/owner}{/repo}",
     "subscriptions_url": "https://api.github.com/users/adrianharabula/subscriptions",
     "organizations_url": "https://api.github.com/users/adrianharabula/orgs",
     "repos_url": "https://api.github.com/users/adrianharabula/repos",
     "events_url": "https://api.github.com/users/adrianharabula/events{/privacy}",
     "received_events_url": "https://api.github.com/users/adrianharabula/received_events",
     "type": "User",
     "site_admin": false
    },
    "created_at": "5/29/2017",
    "updated_at": "2017-05-29T00:53:17Z",
    "body": "Am găsit şi documentaţia pentru apiul de mai sus. http://www.upcitemdb.com/wp/docs/main/development/responses/"
   },
   {
    "url": "https://api.github.com/repos/adrianharabula/condr/issues/comments/305310984",
    "html_url": "https://github.com/adrianharabula/condr/issues/149#issuecomment-305310984",
    "issue_url": "https://api.github.com/repos/adrianharabula/condr/issues/149",
    "id": 305310984,
    "user": {
     "login": "elis47",
     "id": 13468137,
     "avatar_url": "https://avatars2.githubusercontent.com/u/13468137?v=3",
     "gravatar_id": "",
     "url": "https://api.github.com/users/elis47",
     "html_url": "https://github.com/elis47",
     "followers_url": "https://api.github.com/users/elis47/followers",
     "following_url": "https://api.github.com/users/elis47/following{/other_user}",
     "gists_url": "https://api.github.com/users/elis47/gists{/gist_id}",
     "starred_url": "https://api.github.com/users/elis47/starred{/owner}{/repo}",
     "subscriptions_url": "https://api.github.com/users/elis47/subscriptions",
     "organizations_url": "https://api.github.com/users/elis47/orgs",
     "repos_url": "https://api.github.com/users/elis47/repos",
     "events_url": "https://api.github.com/users/elis47/events{/privacy}",
     "received_events_url": "https://api.github.com/users/elis47/received_events",
     "type": "User",
     "site_admin": false
    },
    "created_at": "5/31/2017",
    "updated_at": "2017-05-31T20:41:59Z",
    "body": "Api pentru scanarea codului de bare\r\nhttps://www.microsoft.com/en-us/store/p/scandit-barcode-scanner/9nblggh4sskh"
   },
   {
    "url": "https://api.github.com/repos/adrianharabula/condr/issues/comments/305402786",
    "html_url": "https://github.com/adrianharabula/condr/issues/149#issuecomment-305402786",
    "issue_url": "https://api.github.com/repos/adrianharabula/condr/issues/149",
    "id": 305402786,
    "user": {
     "login": "adrianharabula",
     "id": 2271038,
     "avatar_url": "https://avatars0.githubusercontent.com/u/2271038?v=3",
     "gravatar_id": "",
     "url": "https://api.github.com/users/adrianharabula",
     "html_url": "https://github.com/adrianharabula",
     "followers_url": "https://api.github.com/users/adrianharabula/followers",
     "following_url": "https://api.github.com/users/adrianharabula/following{/other_user}",
     "gists_url": "https://api.github.com/users/adrianharabula/gists{/gist_id}",
     "starred_url": "https://api.github.com/users/adrianharabula/starred{/owner}{/repo}",
     "subscriptions_url": "https://api.github.com/users/adrianharabula/subscriptions",
     "organizations_url": "https://api.github.com/users/adrianharabula/orgs",
     "repos_url": "https://api.github.com/users/adrianharabula/repos",
